instrument,alpha,key,text,label
Foa2002,0.87,1,我喜歡炫耀我的身體。,身體吸引力
Foa2002,0.87,1,我需要事物以特定順序排列。,強迫症症狀
Foa2002,0.87,1,我反復檢查門、窗和抽屜。,強迫症症狀
Foa2002,0.87,1,我有時必須清潔自己只是因為我覺得被污染了。,強迫症症狀
Foa2002,0.87,1,我洗手的次數超過必要。,強迫症症狀
Goldberg1999,0.9,1,我開車或乘車到某個地方，後來不記得整個或部分旅程中發生的事。,解離
Goldberg1999,0.9,1,我覺得好像透過迷霧看世界，以至於人們和物體看起來很遙遠或不清楚。,解離
Goldberg1999,0.9,1,我覺得我與我的身體分離了。,解離
Goldberg1999,0.9,1,我在清醒時覺得自己在做夢。,解離
Goldberg1999,0.9,1,我覺得我無法移動我的手或腳。,解離
Goldberg1999,0.9,1,我發現自己有時坐著凝視空間，什麼都不想，並且沒有意識到時間的流逝。,解離
Goldberg1999,0.9,1,我發現在某些情況下，我能夠以驚人的輕鬆和自發性做通常對我來說很困難的事情。,解離
Goldberg1999,0.9,1,我發現在一種情況下我的行為與在另一種情況下如此不同，以至於我覺得自己幾乎是兩個不同的人。,解離
Goldberg1999,0.9,1,我發現證據表明我做過我不記得做過的事情。,解離
Goldberg1999,0.9,1,我發現自己穿著我不記得穿上的衣服。,解離
Goldberg1999,0.9,1,我發現自己在一個地方，不知道我是如何到達那裡的。,解離
Goldberg1999,0.9,1,我在我的物品中發現了我不記得購買的新東西。,解離
Goldberg1999,0.9,1,我發現我變得如此投入幻想或白日夢，以至於感覺它真的發生在我身上。,解離
Goldberg1999,0.9,1,我發現我無法記住自己是做了某事還是只是想做那件事。,解離
Goldberg1999,0.9,1,我發現我對生活中某個重要事件沒有記憶（例如，婚禮或畢業典禮）。,解離
Goldberg1999,0.9,1,我發現我聽到腦海中的聲音告訴我做事或評論我正在做的事情。,解離
Goldberg1999,0.9,1,我發現我能夠忽視疼痛。,解離
Goldberg1999,0.9,1,我發現當我看電視或電影時，我變得如此沉浸在故事中，以至於沒有意識到周圍發生的其他事件。,解離
Goldberg1999,0.9,1,我在我的物品中發現文字、圖畫或筆記，我一定做過但不記得做過。,解離
Goldberg1999,0.9,1,我有被指控說謊的經歷，而我認為我沒有說謊。,解離
Goldberg1999,0.9,1,我有在熟悉的地方但發現它陌生和不熟悉的經歷。,解離
Goldberg1999,0.9,1,我有感覺自己站在自己旁邊或看著自己好像在看不同人的經歷。,解離
Goldberg1999,0.9,1,我有感覺我的身體不屬於我的經歷。,解離
Goldberg1999,0.9,1,我有感覺其他人、物體和周圍的世界不真實的經歷。,解離
Goldberg1999,0.9,1,我有照鏡子但不認識自己的經歷。,解離
Goldberg1999,0.9,1,我有不確定我記得發生的事情是否真的發生過，還是我只是夢到它們的經歷。,解離
Goldberg1999,0.9,1,我有如此生動地記住過去事件的經歷，以至於感覺我正在重溫那個事件。,解離
Goldberg1999,0.9,1,我大聲自言自語。,解離
Goldberg1999,0.9,1,我被一個我不認識的人接近，他用另一個名字叫我，或者堅持認為他或她以前見過我。,解離
Goldberg1999,0.9,1,我聽別人說話，突然意識到我沒有聽到部分或全部所說的話。,解離
Goldberg1999,0.9,1,我被告知我有時不認識朋友或家人。,解離
HEXACO_PI,0.81,1,我接受他人本來的樣子。,溫和
HEXACO_PI,0.8,-1,當有事情困擾我時，我會衝動行事。,審慎
HEXACO_PI,0.81,-1,我在不同情況下表現得像不同的人。,真誠
HEXACO_PI,0.73,1,我容易適應。,靈活性
HEXACO_PI,0.77,-1,我欣賞真正聰明的騙局。,公平/公正
HEXACO_PI,0.84,1,我是個身體上的懦夫。,恐懼
HEXACO_PI,0.73,-1,我會因他人的錯誤而感到煩躁。,靈活性
HEXACO_PI,0.84,1,我被認為有點古怪。,非傳統性
HEXACO_PI,0.79,1,我深受他人的不幸所感動。,多愁善感
HEXACO_PI,0.88,-1,我容易被激怒。,耐心
HEXACO_PI,0.81,1,我對工作要求嚴格。,勤勉
HEXACO_PI,0.85,1,我充滿想法。,創造力/原創性
HEXACO_PI,0.86,1,我擅長即興演講。,社交大膽
HEXACO_PI,0.73,1,我善於接受建議。,靈活性
HEXACO_PI,0.73,-1,我很難被說服。,靈活性
HEXACO_PI,0.85,-1,我很難被了解。,社交性
HEXACO_PI,0.73,-1,我很難被說服。,靈活性
HEXACO_PI,0.73,-1,我很難被滿足。,靈活性
HEXACO_PI,0.78,1,我傾向於原諒他人。,寬恕/仁慈
HEXACO_PI,0.78,1,我對科學感興趣。,好奇心
HEXACO_PI,0.81,1,我只是個普通人。,謙虛/謙遜
HEXACO_PI,0.81,-1,如果有機會的話我可能會炫耀。,謙虛/謙遜
HEXACO_PI,0.69,-1,我主要對金錢感興趣。,避免貪婪
HEXACO_PI,0.81,-1,我比大多數人更有能力。,謙虛/謙遜
HEXACO_PI,0.84,1,我從不詞窮。,表達性
HEXACO_PI,0.78,1,我對應該生氣的人也很好。,寬恕/仁慈
HEXACO_PI,0.85,-1,我不會被混亂所困擾。,組織
HEXACO_PI,0.85,-1,我不容易被事件所困擾。,焦慮
HEXACO_PI,0.69,-1,我是為了自己的個人利益。,避免貪婪
HEXACO_PI,0.81,-1,我很快就對他人下判斷。,溫和
HEXACO_PI,0.79,-1,我很少被陌生人明顯的痛苦所困擾。,多愁善感
HEXACO_PI,0.79,1,我對他人的需求很敏感。,多愁善感
HEXACO_PI,0.84,1,我是派對的靈魂人物。,表達性
HEXACO_PI,0.88,1,我通常是個有耐心的人。,耐心
HEXACO_PI,0.82,1,我通常很活躍並充滿活力。,活潑
HEXACO_PI,0.84,-1,我願意冒險。,恐懼
HEXACO_PI,0.78,-1,我避免閱讀困難的材料。,好奇心
HEXACO_PI,0.8,1,我避免錯誤。,審慎
HEXACO_PI,0.81,-1,當人們沒有達到我的期望時，我會感到沮喪和憤怒。,溫和
HEXACO_PI,0.84,1,當有危險時我開始驚慌。,恐懼
HEXACO_PI,0.81,-1,我相信自己比他人優越。,謙虛/謙遜
HEXACO_PI,0.81,-1,我吹噓自己的美德。,謙虛/謙遜
HEXACO_PI,0.84,-1,我壓抑自己的感受。,表達性
HEXACO_PI,0.73,1,我離不開他人的陪伴。,順從/依賴/需要認可
HEXACO_PI,0.73,-1,我無法忍受被反駁。,靈活性
HEXACO_PI,0.85,1,我能將對話提升到更高層次。,創造力/原創性
HEXACO_PI,0.77,-1,我欺騙信任我的人。,公平/公正
HEXACO_PI,0.77,-1,我作弊以求進步。,公平/公正
HEXACO_PI,0.85,1,我想出新的東西。,創造力/原創性
HEXACO_PI,0.81,1,我成功完成任務。,勤勉
HEXACO_PI,0.81,1,我認為自己是個普通人。,謙虛/謙遜
HEXACO_PI,0.81,-1,我批評他人的缺點。,溫和
HEXACO_PI,0.8,1,我要求品質。,完美主義
HEXACO_PI,0.8,1,我能發現錯誤。,完美主義
HEXACO_PI,0.8,1,我不喜歡不完美的工作。,完美主義
HEXACO_PI,0.78,-1,我不信任人們。,寬恕/仁慈
HEXACO_PI,0.81,-1,我只做足夠的工作。,勤勉
HEXACO_PI,0.83,-1,我不喜歡觀看舞蹈表演。,美學欣賞/藝術興趣
HEXACO_PI,0.85,-1,我沒有良好的想像力。,創造力/原創性
HEXACO_PI,0.83,-1,我不喜歡藝術。,美學欣賞/藝術興趣
HEXACO_PI,0.83,-1,我不喜歡音樂會。,美學欣賞/藝術興趣
HEXACO_PI,0.8,1,我按計劃做事。,審慎
HEXACO_PI,0.84,1,我做他人覺得奇怪的事。,非傳統性
HEXACO_PI,0.8,-1,我做事不考慮後果。,審慎
HEXACO_PI,0.81,-1,我做的工作太少。,勤勉
HEXACO_PI,0.78,-1,我不為政治和社會問題煩惱。,好奇心
HEXACO_PI,0.85,-1,我不完成我開始的事。,組織
HEXACO_PI,0.78,-1,我對歷史了解不多。,好奇心
HEXACO_PI,0.8,-1,我不知道為什麼我做某些事。,審慎
HEXACO_PI,0.84,-1,我不喜歡引起注意。,表達性
HEXACO_PI,0.86,1,我不介意成為注意力的焦點。,社交大膽
HEXACO_PI,0.81,1,我不假裝自己比實際更多。,真誠
HEXACO_PI,0.69,1,我不追求外表的優雅。,避免貪婪
HEXACO_PI,0.84,-1,我話不多。,表達性
HEXACO_PI,0.81,1,我不認為自己比他人優越。,謙虛/謙遜
HEXACO_PI,0.85,1,我喜歡成為團體的一員。,社交性
HEXACO_PI,0.84,-1,我喜歡被認為是正常的主流人士。,非傳統性
HEXACO_PI,0.83,1,我喜歡感覺「接近大地」。,美學欣賞/藝術興趣
HEXACO_PI,0.78,1,我喜歡智力遊戲。,好奇心
HEXACO_PI,0.84,-1,我自信地面對危險。,恐懼
HEXACO_PI,0.86,1,我在人群中感到自在。,社交大膽
HEXACO_PI,0.82,1,我大部分時間都感到健康和充滿活力。,活潑
HEXACO_PI,0.79,1,我能感受他人的情緒。,多愁善感
HEXACO_PI,0.82,1,我覺得自己有很多內在力量。,活潑
HEXACO_PI,0.78,-1,我覺得大多數人不能被信任。,寬恕/仁慈
HEXACO_PI,0.81,-1,我對一切都挑剔。,溫和
HEXACO_PI,0.86,-1,我發現很難接近他人。,社交大膽
HEXACO_PI,0.78,-1,我發現很難原諒他人。,寬恕/仁慈
HEXACO_PI,0.81,-1,我發現有必要取悅有權力的人。,真誠
HEXACO_PI,0.78,1,我發現政治討論很有趣。,好奇心
HEXACO_PI,0.88,1,我發現需要很多才能讓我對某人感到憤怒。,耐心
HEXACO_PI,0.88,-1,我容易生氣。,耐心
HEXACO_PI,0.78,-1,我會報復侮辱我的人。,寬恕/仁慈
HEXACO_PI,0.85,1,我馬上完成家務。,組織
HEXACO_PI,0.78,-1,我會報復他人。,寬恕/仁慈
HEXACO_PI,0.88,-1,我容易感到煩躁。,耐心
HEXACO_PI,0.81,1,我快速開始做工作。,勤勉
HEXACO_PI,0.85,1,我被進入腦海的不愉快想法所困擾。,焦慮
HEXACO_PI,0.88,-1,我容易沮喪。,耐心
HEXACO_PI,0.73,-1,如果他人改變我排列的方式，我會感到不安。,靈活性
HEXACO_PI,0.81,-1,我閒逛無所事事。,勤勉
HEXACO_PI,0.86,-1,我討厭成為注意力的焦點。,社交大膽
HEXACO_PI,0.81,1,我對每個人都有好話說。,溫和
HEXACO_PI,0.82,1,我玩得很開心。,活潑
HEXACO_PI,0.78,1,我的詞彙量很豐富。,好奇心
HEXACO_PI,0.81,-1,我說話尖酸刻薄。,溫和
HEXACO_PI,0.69,-1,我有強烈的權力需求。,避免貪婪
HEXACO_PI,0.86,1,我有強烈的個性。,社交大膽
HEXACO_PI,0.85,1,我有生動的想像力。,創造力/原創性
HEXACO_PI,0.8,1,我對細節有敏銳的觀察。,完美主義
HEXACO_PI,0.84,1,我有強烈、喧鬧的笑聲。,表達性
HEXACO_PI,0.85,-1,我難以想像事物。,創造力/原創性
HEXACO_PI,0.85,1,我有很好的想法。,創造力/原創性
HEXACO_PI,0.82,1,我有很強的耐力。,活潑
HEXACO_PI,0.86,1,我有領導能力。,社交大膽
HEXACO_PI,0.86,-1,我沒什麼話可說。,社交大膽
HEXACO_PI,0.83,1,我讀過偉大的文學經典。,美學欣賞/藝術興趣
HEXACO_PI,0.85,-1,我無法猜測他人會如何反應。,創造力/原創性
HEXACO_PI,0.78,-1,我會記仇。,寬恕/仁慈
HEXACO_PI,0.79,1,聽到不幸事件時我立即感到悲傷。,多愁善感
HEXACO_PI,0.8,-1,我不假思索就投入事情。,審慎
HEXACO_PI,0.86,-1,我保持低調。,社交大膽
HEXACO_PI,0.85,-1,我與他人保持距離。,社交性
HEXACO_PI,0.85,1,我保持東西整潔。,組織
HEXACO_PI,0.84,1,我知道我的想法有時會讓人感到驚訝。,非傳統性
HEXACO_PI,0.82,1,我經常笑。,活潑
HEXACO_PI,0.85,-1,我把房間弄得一團糟。,組織
HEXACO_PI,0.85,-1,我到處亂放東西。,組織
HEXACO_PI,0.73,1,我讓自己被他人影響。,順從/依賴/需要認可
HEXACO_PI,0.81,-1,我讓人欺負我以幫助他們感覺重要。,真誠
HEXACO_PI,0.85,1,我喜歡秩序。,組織
HEXACO_PI,0.81,-1,我喜歡吸引注意力。,謙虛/謙遜
HEXACO_PI,0.84,-1,我喜歡被認為是正常人。,非傳統性
HEXACO_PI,0.84,-1,我喜歡被視為得體和傳統的人。,非傳統性
HEXACO_PI,0.84,-1,我喜歡做令人害怕的事情。,恐懼
HEXACO_PI,0.85,1,我喜歡整理。,組織
HEXACO_PI,0.88,-1,我會發脾氣。,耐心
HEXACO_PI,0.84,-1,我喜愛危險的情況。,恐懼
HEXACO_PI,0.69,-1,我喜愛奢華。,避免貪婪
HEXACO_PI,0.78,1,我愛我的敵人。,寬恕/仁慈
HEXACO_PI,0.85,1,我喜愛聊天。,社交性
HEXACO_PI,0.78,1,我喜愛閱讀有挑戰性的材料。,好奇心
HEXACO_PI,0.85,1,我喜愛想出新的做事方法。,創造力/原創性
HEXACO_PI,0.82,1,我全天保持高能量。,活潑
HEXACO_PI,0.8,-1,我讓自己出醜。,審慎
HEXACO_PI,0.8,-1,我犯粗心的錯誤。,審慎
HEXACO_PI,0.85,1,我很容易交朋友。,社交性
HEXACO_PI,0.8,1,我制定計劃並堅持執行。,審慎
HEXACO_PI,0.8,-1,我做出魯莽的決定。,審慎
HEXACO_PI,0.73,1,我需要保護。,順從/依賴/需要認可
HEXACO_PI,0.73,1,我需要安慰。,順從/依賴/需要認可
HEXACO_PI,0.73,1,我需要他人的認可。,順從/依賴/需要認可
HEXACO_PI,0.82,-1,我經常感到憂鬱。,活潑
HEXACO_PI,0.85,-1,我經常忘記把東西放回原處。,組織
HEXACO_PI,0.73,1,我經常需要幫助。,順從/依賴/需要認可
HEXACO_PI,0.8,1,我注意細節。,完美主義
HEXACO_PI,0.8,-1,我對細節關注太少。,完美主義
HEXACO_PI,0.81,-1,我扮演角色以給人留下深刻印象。,真誠
HEXACO_PI,0.69,-1,我更喜歡在昂貴的餐廳用餐。,避免貪婪
HEXACO_PI,0.8,-1,我更喜歡順其自然。,完美主義
HEXACO_PI,0.81,-1,我假裝關心他人。,真誠
HEXACO_PI,0.81,1,我非常努力地推動自己成功。,勤勉
HEXACO_PI,0.81,-1,我做秀以給人留下深刻印象。,真誠
HEXACO_PI,0.81,-1,我很快就對開始的任務失去興趣。,勤勉
HEXACO_PI,0.81,1,我很少抱怨。,溫和
HEXACO_PI,0.79,-1,我很少在悲傷的電影中哭泣。,多愁善感
HEXACO_PI,0.85,-1,我很少享受與人在一起。,社交性
HEXACO_PI,0.88,1,我很少對人感到憤怒。,耐心
HEXACO_PI,0.88,1,我很少感到煩躁。,耐心
HEXACO_PI,0.73,-1,我對批評反應強烈。,靈活性
HEXACO_PI,0.84,1,我反抗權威。,非傳統性
HEXACO_PI,0.85,-1,我在壓力下保持冷靜。,焦慮
HEXACO_PI,0.77,1,當收銀員犯錯時，我會退回多餘的零錢。,公平/公正
HEXACO_PI,0.84,-1,我話少。,表達性
HEXACO_PI,0.81,1,我把自己看作普通人。,謙虛/謙遜
HEXACO_PI,0.69,-1,我尋求地位。,避免貪婪
HEXACO_PI,0.73,1,我尋求支持。,順從/依賴/需要認可
HEXACO_PI,0.85,-1,我似乎從與人互動中獲得的樂趣比他人少。,社交性
HEXACO_PI,0.85,-1,我很少經歷突然的直覺洞察。,創造力/原創性
HEXACO_PI,0.79,-1,我在閱讀故事的悲傷部分時很少感到想哭。,多愁善感
HEXACO_PI,0.79,-1,我很少情緒化。,多愁善感
HEXACO_PI,0.88,1,我很少生氣。,耐心
HEXACO_PI,0.73,1,我表現出我的悲傷。,順從/依賴/需要認可
HEXACO_PI,0.82,1,我經常微笑。,活潑
HEXACO_PI,0.81,-1,我說他人的壞話。,溫和
HEXACO_PI,0.84,-1,我說話輕聲細語。,表達性
HEXACO_PI,0.77,-1,我偷東西。,公平/公正
HEXACO_PI,0.81,-1,當工作變得太困難時我就停止。,勤勉
HEXACO_PI,0.73,1,我懷疑當我感到悲傷時，我的面部表情會洩露我。,順從/依賴/需要認可
HEXACO_PI,0.84,1,我逆流而上。,非傳統性
HEXACO_PI,0.81,-1,我想改變時就改變忠誠。,真誠
HEXACO_PI,0.81,1,我順其自然。,溫和
HEXACO_PI,0.84,1,我話很多。,表達性
HEXACO_PI,0.81,-1,我告訴他人他們想聽的話，以便他們做我想讓他們做的事。,真誠
HEXACO_PI,0.84,1,當我感到煩躁時，我會告訴人們。,表達性
HEXACO_PI,0.82,-1,我很快就累了。,活潑
HEXACO_PI,0.84,1,我在危險情況下會顫抖。,恐懼
HEXACO_PI,0.84,-1,我試圖避開複雜的人。,非傳統性
HEXACO_PI,0.77,1,我試圖遵守規則。,公平/公正
HEXACO_PI,0.78,1,我試圖原諒和忘記。,寬恕/仁慈
HEXACO_PI,0.69,-1,我試圖給他人留下深刻印象。,避免貪婪
HEXACO_PI,0.81,-1,我用奉承來求進步。,真誠
HEXACO_PI,0.85,1,我通常喜歡與人一起度過空閒時間。,社交性
HEXACO_PI,0.8,1,我希望一切都完美相加。,完美主義
HEXACO_PI,0.85,1,我希望一切都恰到好處。,組織
HEXACO_PI,0.73,1,我想被人喜歡。,順從/依賴/需要認可
HEXACO_PI,0.73,-1,當與一群人互動時，我經常被其中至少一個人困擾。,靈活性
HEXACO_PI,0.78,-1,我不會深入探討主題。,好奇心
HEXACO_PI,0.69,-1,我希望永遠保持年輕。,避免貪婪
HEXACO_PI,0.81,1,我努力工作。,勤勉
HEXACO_PI,0.86,-1,我會害怕在公開場合發表演講。,社交大膽
HEXACO_PI,0.84,-1,我會擅長從燃燒的建築物中營救人們。,恐懼
HEXACO_PI,0.84,1,我會害怕在城市的高犯罪率地區行走。,恐懼
HEXACO_PI,0.77,1,如果我從某人那裡偷東西，我會感到非常難過很長時間。,公平/公正
HEXACO_PI,0.84,-1,我會討厭被認為是古怪或奇怪的。,非傳統性
HEXACO_PI,0.81,-1,我想擁有比他人更多的權力。,謙虛/謙遜
HEXACO_PI,0.78,1,我會喜歡探索陌生的地方。,好奇心
HEXACO_PI,0.77,1,我永遠不會在報稅時作弊。,公平/公正
HEXACO_PI,0.84,1,我永遠不會乘獨木舟順著一段急流而下。,恐懼
HEXACO_PI,0.77,1,我永遠不會拿不屬於我的東西。,公平/公正
HEXACO_PI,0.85,-1,我不會喜歡涉及大量社交互動的工作。,社交性
HEXACO_PI,0.69,1,我不會喜歡成為著名名人。,避免貪婪
HEXACO_PI,0.77,-1,如果我衝動地占某人便宜，我不會後悔我的行為。,公平/公正
Hoyle2002,0.84,1,行為狂野瘋狂。,冒險/尋求感覺/尋求刺激
Hoyle2002,0.78,-1,我是個身體上的懦夫。,冒險/尋求感覺/尋求刺激
Hoyle2002,0.78,-1,我害怕高處。,冒險/尋求感覺/尋求刺激
Hoyle2002,0.78,-1,我害怕大狗。,冒險/尋求感覺/尋求刺激
Hoyle2002,0.84,1,我容易被說服做傻事。,冒險/尋求感覺/尋求刺激
Hoyle2002,0.78,1,我對新經驗持開放態度。,冒險/尋求感覺/尋求刺激
Hoyle2002,0.84,1,我不可預測，人們永遠不知道我會說什麼。,冒險/尋求感覺/尋求刺激
Hoyle2002,0.78,1,我願意冒險。,冒險/尋求感覺/尋求刺激
Hoyle2002,0.84,1,我做意想不到的事情。,冒險/尋求感覺/尋求刺激
Hoyle2002,0.84,1,我喜歡狂野的幻想飛行。,冒險/尋求感覺/尋求刺激
Hoyle2002,0.78,1,我自信地面對危險。,冒險/尋求感覺/尋求刺激
Hoyle2002,0.86,1,我可能會喜歡被困在地震或龍捲風中。,冒險/尋求感覺/尋求刺激
Hoyle2002,0.86,1,我可能會喜歡從飛機上自由落體。,冒險/尋求感覺/尋求刺激
Hoyle2002,0.86,1,我可能會喜歡在海上迷失的刺激。,冒險/尋求感覺/尋求刺激
Hoyle2002,0.86,1,我更喜歡恐懼而不是無聊。,冒險/尋求感覺/尋求刺激
Hoyle2002,0.84,1,我尋求冒險。,冒險/尋求感覺/尋求刺激
Hoyle2002,0.84,1,我冒險。,冒險/尋求感覺/尋求刺激
Hoyle2002,0.78,-1,當天氣不好時我試圖待在室內。,冒險/尋求感覺/尋求刺激
Hoyle2002,0.78,1,我會擅長從燃燒的建築物中營救人們。,冒險/尋求感覺/尋求刺激
Hoyle2002,0.86,1,我會喜歡在暴風雨期間乘帆船出海。,冒險/尋求感覺/尋求刺激
Hoyle2002,0.86,-1,我會害怕在城市的高犯罪率地區行走。,冒險/尋求感覺/尋求刺激
Hoyle2002,0.86,1,我想嘗試高空彈跳。,冒險/尋求感覺/尋求刺激
Hoyle2002,0.78,1,我會喜歡探索陌生的地方。,冒險/尋求感覺/尋求刺激
Hoyle2002,0.78,-1,我永遠不會乘獨木舟順著一段急流而下。,冒險/尋求感覺/尋求刺激
HPI,0.8,1,我完成很多工作。,能力
HPI,0.76,-1,行為狂野瘋狂。,合作
HPI,0.77,-1,我擔心自己會做錯事。,堅韌性
HPI,0.82,-1,我容易感到沮喪。,領導力
HPI,0.82,-1,我容易被威脅。,領導力
HPI,0.76,1,我容易滿足。,冷靜
HPI,0.86,1,我對人感興趣。,友善
HPI,0.86,1,我不容易被激怒。,穩定性
HPI,0.77,1,我不容易感到尷尬。,堅韌性
HPI,0.83,-1,我對抽象概念不感興趣。,創造力/原創性
HPI,0.86,-1,我對他人不太感興趣。,友善
HPI,0.8,-1,我不確定我的生活方向。,能力
HPI,0.86,-1,我經常心情不好。,穩定性
HPI,0.76,1,我與幾乎每個人都相處融洽。,冷靜
HPI,0.76,-1,我很快就對他人下判斷。,冷靜
HPI,0.86,1,我大部分時間都很放鬆。,穩定性
HPI,0.87,1,我對自己非常滿意。,快樂
HPI,0.75,1,我逗朋友開心。,社交性
HPI,0.77,1,我自動掌控局面。,堅韌性
HPI,0.83,-1,我避免閱讀困難的材料。,創造力/原創性
HPI,0.76,-1,我違反規則。,合作
HPI,0.8,1,我執行我的計劃。,能力
HPI,0.86,1,我讓人們振作起來。,友善
HPI,0.8,1,我成功完成任務。,能力
HPI,0.86,-1,我不喜歡成為注意力的焦點。,合群性
HPI,0.75,-1,我不喜歡吵鬧的音樂。,社交性
HPI,0.78,-1,我做瘋狂的事情。,盡責性
HPI,0.8,-1,我只做足夠的工作。,能力
HPI,0.78,-1,我做他人覺得奇怪的事。,盡責性
HPI,0.78,-1,我做意想不到的事情。,盡責性
HPI,0.86,1,我不介意成為注意力的焦點。,合群性
HPI,0.78,-1,我喜歡冒險行事。,盡責性
HPI,0.76,-1,我喜歡狂野的幻想飛行。,合作
HPI,0.86,1,我與人相處感到自在。,友善
HPI,0.87,-1,我感到絕望。,快樂
HPI,0.77,-1,我覺得自己無法處理事情。,堅韌性
HPI,0.8,-1,我覺得我的生活缺乏方向。,能力
HPI,0.76,-1,我覺得人們很難理解我。,合作
HPI,0.77,-1,我容易感到威脅。,堅韌性
HPI,0.82,-1,我發現很難接近他人。,領導力
HPI,0.8,1,我快速完成事情。,能力
HPI,0.8,-1,我閒逛無所事事。,能力
HPI,0.82,-1,我對自己評價很低。,領導力
HPI,0.82,-1,我的詞彙量很少。,敏捷性
HPI,0.82,1,我的詞彙量很豐富。,敏捷性
HPI,0.76,-1,我說話尖酸刻薄。,冷靜
HPI,0.86,-1,我有對世界感到憤怒的日子。,穩定性
HPI,0.86,-1,我情緒經常波動。,穩定性
HPI,0.86,-1,我沒什麼話可說。,合群性
HPI,0.76,-1,我會記仇。,冷靜
HPI,0.83,1,我知道事物如何運作。,創造力/原創性
HPI,0.86,1,我知道如何吸引人。,合群性
HPI,0.75,1,我喜歡逗樂他人。,社交性
HPI,0.75,1,我喜歡吸引注意力。,社交性
HPI,0.82,1,我喜歡閱讀。,敏捷性
HPI,0.76,-1,我尋找事物中隱藏的意義。,合作
HPI,0.75,1,我喜愛行動。,社交性
HPI,0.75,1,我喜歡大型派對。,社交性
HPI,0.83,1,我喜愛閱讀有挑戰性的材料。,創造力/原創性
HPI,0.75,1,我讓自己成為注意力的焦點。,社交性
HPI,0.8,-1,我把事情搞砸。,能力
HPI,0.87,-1,我經常感到憂鬱。,快樂
HPI,0.77,-1,我經常在他人身邊感到不自在。,堅韌性
HPI,0.76,-1,我反對權威。,合作
HPI,0.82,1,我能快速理解事物。,敏捷性
HPI,0.77,1,我快速識別可能性。,堅韌性
HPI,0.86,1,我很少感到煩躁。,穩定性
HPI,0.76,1,我很少過度放縱。,合作
HPI,0.82,1,我閱讀很快。,敏捷性
HPI,0.82,-1,我閱讀很慢。,敏捷性
HPI,0.87,1,我輕易克服挫折。,快樂
HPI,0.77,1,我在壓力下保持冷靜。,堅韌性
HPI,0.76,-1,我抗拒權威。,合作
HPI,0.75,1,我尋求冒險。,社交性
HPI,0.76,1,我很少感到被冒犯。,冷靜
HPI,0.82,-1,我閱讀時會跳過困難的字。,敏捷性
HPI,0.76,-1,我說他人的壞話。,冷靜
HPI,0.76,-1,我懷疑他人有隱藏動機。,合作
HPI,0.76,-1,我逆流而上。,合作
HPI,0.82,1,我採取主動。,領導力
HPI,0.82,1,我對自己評價很高。,領導力
HPI,0.83,-1,我試圖避開複雜的人。,創造力/原創性
HPI,0.77,1,我想要掌控。,堅韌性
HPI,0.86,-1,我想被獨處。,友善
HPI,0.86,-1,我會把我的經歷描述為有點沉悶。,合群性
HPI-HIC,0.75,1,我容易接受道歉。,寬恕/仁慈
HPI-HIC,0.7,1,我接受具挑戰性的任務。,成就追求
HPI-HIC,0.66,1,我接受他人本來的樣子。,寬恕/仁慈
HPI-HIC,0.61,-1,我以犧牲他人為代價行事。,敏感性
HPI-HIC,0.68,-1,我害怕很多事情。,堅韌性
HPI-HIC,0.74,-1,我害怕引起注意。,社交自信
HPI-HIC,0.7,1,我總是準備充分。,自律
HPI-HIC,0.74,-1,我對新遭遇感到擔憂。,社交自信
HPI-HIC,0.75,1,即使在緊張的情況下我也很冷靜。,冷靜
HPI-HIC,0.61,1,我深受他人的不幸所感動。,敏感性
HPI-HIC,0.8,-1,我容易感到沮喪。,活力/熱情/熱忱
HPI-HIC,0.5,-1,我容易分心。,遊戲興趣
HPI-HIC,0.74,-1,我容易受到威脅。,自信
HPI-HIC,0.64,1,我容易被說服做傻事。,社交性
HPI-HIC,0.61,-1,我容易被說服做傻事。,條理性
HPI-HIC,0.7,1,我擅長很多事情。,成就追求
HPI-HIC,0.79,1,我不容易被激怒。,同理心
HPI-HIC,0.79,1,我不容易被事情困擾。,冷靜
HPI-HIC,0.74,1,我不容易感到尷尬。,社交自信
HPI-HIC,0.7,-1,我沒有強烈的成功動機。,成就追求
HPI-HIC,0.75,-1,我對他人的問題不感興趣。,同理心
HPI-HIC,0.8,-1,我不確定我的生活方向。,活力/熱情/熱忱
HPI-HIC,0.7,-1,我經常心情不好。,愉快性
HPI-HIC,0.66,1,我與幾乎每個人都相處融洽。,寬恕/仁慈
HPI-HIC,0.68,1,我專注於自己。,沉思
HPI-HIC,0.74,1,我擅長處理社交情況。,社交自信
HPI-HIC,0.74,1,我對自己的立場很確定。,自信
HPI-HIC,0.84,1,我會逗朋友開心。,幽默/玩樂性
HPI-HIC,0.68,-1,我避免人群。,合群性
HPI-HIC,0.8,-1,我避免閱讀困難的材料。,閱讀熱愛
HPI-HIC,0.68,1,我相信外表很重要。,外表意識
HPI-HIC,0.74,1,我相信人性本善。,信任
HPI-HIC,0.74,-1,我相信人們本質上是邪惡的。,信任
HPI-HIC,0.8,1,我能處理大量資訊。,語言精通
HPI-HIC,0.66,1,我能執行各種各樣的任務。,好奇心
HPI-HIC,0.81,1,我能說服他人做事。,領導力
HPI-HIC,0.44,1,我能在壓力下工作。,解決問題
HPI-HIC,0.64,1,我在體育賽事中大聲歡呼。,社交性
HPI-HIC,0.72,1,我會堅持到一切完美為止。,組織
HPI-HIC,0.83,-1,我不喜歡成為注意力的焦點。,表現慾
HPI-HIC,0.6,-1,我不喜歡學習。,解決問題
HPI-HIC,0.6,-1,我不喜歡學習。,好奇心
HPI-HIC,0.71,-1,我不喜歡自己。,自我接納
HPI-HIC,0.66,-1,我不喜歡新食物。,尋求變化
HPI-HIC,0.83,-1,我不喜歡談論自己。,表現慾
