3048,26,5,Prefer variety to routine.,我喜歡變化而非常規。,0.770,,1,X204,1,2025-12-08 00:00:00.0000000,
3049,26,151,Pretend to be concerned for others.,我假裝關心他人。,0.750,,1,X113,1,2025-12-08 00:00:00.0000000,
3050,26,1,Put little time and effort into my work.,我在工作上投入很少時間和精力。,0.780,,1,X167,1,2025-12-08 00:00:00.0000000,
3051,26,151,Put people under pressure.,我給人施加壓力。,0.750,,1,H774,1,2025-12-08 00:00:00.0000000,
3052,26,26,Radiate joy.,我散發喜悅。,0.810,,1,"H32, X63",1,2025-12-08 00:00:00.0000000,
3053,26,12,Rarely complain.,我很少抱怨。,0.880,,1,E120,1,2025-12-08 00:00:00.0000000,
3054,26,57,Rarely notice my emotional reactions.,我很少注意到自己的情緒反應。,0.810,,1,X10,1,2025-12-08 00:00:00.0000000,
3055,26,88,Rarely overindulge.,我很少過度放縱。,0.770,,1,X181,1,2025-12-08 00:00:00.0000000,
3056,26,2,React quickly.,我反應快速。,0.710,,1,H1324,1,2025-12-08 00:00:00.0000000,
3057,26,2,React slowly.,我反應緩慢。,0.710,,1,H631,1,2025-12-08 00:00:00.0000000,
3058,26,243,Readily overcome setbacks.,我輕易克服挫折。,0.820,,1,H44,1,2025-12-08 00:00:00.0000000,
3059,26,243,Remain calm under pressure.,我在壓力下保持冷靜。,0.820,,1,X79,1,2025-12-08 00:00:00.0000000,
3060,26,25,Rush into things.,我倉促行事。,0.760,,1,"H862, X101",1,2025-12-08 00:00:00.0000000,
3061,26,60,Seek adventure.,我尋求冒險。,0.780,,1,H446,1,2025-12-08 00:00:00.0000000,
3062,26,60,Seek danger.,我尋求危險。,0.780,,1,H894,1,2025-12-08 00:00:00.0000000,
3063,26,77,Seek quiet.,我尋求安靜。,0.790,,1,H602,1,2025-12-08 00:00:00.0000000,
3064,26,16,Seek to influence others.,我尋求影響他人。,0.840,,1,H773,1,2025-12-08 00:00:00.0000000,
3065,26,43,Seldom feel blue.,我很少感到憂鬱。,0.880,,1,X156,1,2025-12-08 00:00:00.0000000,
3066,26,57,Seldom get emotional.,我很少情緒化。,0.810,,1,X29,1,2025-12-08 00:00:00.0000000,
3067,26,12,Seldom get mad.,我很少生氣。,0.880,,1,X231,1,2025-12-08 00:00:00.0000000,
3068,26,26,Seldom joke around.,我很少開玩笑。,0.810,,1,X137,1,2025-12-08 00:00:00.0000000,
3069,26,150,Seldom toot my own horn.,我很少自吹自擂。,0.770,,1,X247,1,2025-12-08 00:00:00.0000000,
3070,26,1,Set high standards for myself and others.,我為自己和他人設定高標準。,0.780,,1,E140,1,2025-12-08 00:00:00.0000000,
3071,26,87,Spend time reflecting on things.,我花時間反思事物。,0.830,,1,X114,1,2025-12-08 00:00:00.0000000,
3072,26,206,Start tasks right away.,我馬上開始工作。,0.850,,1,H511,1,2025-12-08 00:00:00.0000000,
3073,26,25,Stick to my chosen path.,我堅持我選擇的道路。,0.760,,1,H367,1,2025-12-08 00:00:00.0000000,
3074,26,151,Stick to the rules.,我遵守規則。,0.750,,1,H294,1,2025-12-08 00:00:00.0000000,
3075,26,203,Stumble over my words.,我說話結結巴巴。,0.800,,1,H1205,1,2025-12-08 00:00:00.0000000,
3076,26,225,Suffer from others' sorrows.,我為他人的悲傷而受苦。,0.750,,1,"H988, X65",1,2025-12-08 00:00:00.0000000,
3077,26,225,Sympathize with the homeless.,我同情無家可歸者。,0.750,,1,X259,1,2025-12-08 00:00:00.0000000,
3078,26,151,Take advantage of others.,我占他人便宜。,0.750,,1,"H427, V109",1,2025-12-08 00:00:00.0000000,
3079,26,9,Take no time for others.,我不會為他人騰出時間。,0.770,,1,"H918, X170",1,2025-12-08 00:00:00.0000000,
3080,26,52,Tell the truth.,我說實話。,0.710,,1,H145,1,2025-12-08 00:00:00.0000000,
3081,26,150,Think highly of myself.,我對自己評價很高。,0.770,,1,H2043,1,2025-12-08 00:00:00.0000000,
3082,26,235,Think that all will be well.,我認為一切都會好起來。,0.820,,1,H43,1,2025-12-08 00:00:00.0000000,
3083,26,57,Try to understand myself.,我試圖了解自己。,0.810,,1,E123,1,2025-12-08 00:00:00.0000000,
3084,26,9,Turn my back on others.,我背棄他人。,0.770,,1,H1430,1,2025-12-08 00:00:00.0000000,
3085,26,1,Turn plans into actions.,我將計劃轉化為行動。,0.780,,1,H402,1,2025-12-08 00:00:00.0000000,
3086,26,151,Use flattery to get ahead.,我用奉承來求進步。,0.750,,1,X91,1,2025-12-08 00:00:00.0000000,
3087,26,151,Use others for my own ends.,我利用他人謀取私利。,0.750,,1,"H416, X24",1,2025-12-08 00:00:00.0000000,
3088,26,225,Value cooperation over competition.,我重視合作勝過競爭。,0.750,,1,X240,1,2025-12-08 00:00:00.0000000,
3089,26,163,Want everything to be just right.,我希望一切都恰到好處。,0.820,,1,,1,2025-12-08 00:00:00.0000000,
3090,26,77,Want to be left alone.,我想要被獨處。,0.790,,1,H660,1,2025-12-08 00:00:00.0000000,
3091,26,60,Willing to try anything once.,我願意嘗試任何事。,0.780,,1,,1,2025-12-08 00:00:00.0000000,
3092,26,60,Would never go hang gliding or bungee jumping.,我永遠不會去滑翔傘或高空彈跳。,0.780,,1,,1,2025-12-08 00:00:00.0000000,
3093,26,38,Yell at people.,我會對人大吼。,0.730,,1,H809,1,2025-12-08 00:00:00.0000000,
3094,27,8,Am easy to satisfy.,我容易滿足。,0.850,,1,H882,1,2025-12-08 00:00:00.0000000,
3095,27,64,Am hard to get to know.,我很難被了解。,0.910,,1,"H596, X9",1,2025-12-08 00:00:00.0000000,
3096,27,156,Am not easily frustrated.,我不容易感到沮喪。,0.910,,1,X59,1,2025-12-08 00:00:00.0000000,
3097,27,162,Am not interested in abstract ideas.,我對抽象概念不感興趣。,0.890,,1,X228,1,2025-12-08 00:00:00.0000000,
3098,27,162,Am not interested in theoretical discussions.,我對理論討論不感興趣。,0.890,,1,X239,1,2025-12-08 00:00:00.0000000,
3099,27,156,Am often down in the dumps.,我經常情緒低落。,0.910,,1,H640,1,2025-12-08 00:00:00.0000000,
3100,27,8,Am out for my own personal gain.,我是為了自己的個人利益。,0.850,,1,H1325,1,2025-12-08 00:00:00.0000000,
3101,27,156,Am very pleased with myself.,我對自己非常滿意。,0.910,,1,"H737, X36",1,2025-12-08 00:00:00.0000000,
3102,27,64,Avoid contacts with others.,我避免與他人接觸。,0.910,,1,H648,1,2025-12-08 00:00:00.0000000,
3103,27,162,Avoid philosophical discussions.,我避免哲學討論。,0.890,,1,X248,1,2025-12-08 00:00:00.0000000,
3104,27,162,Believe in the importance of art.,我相信藝術的重要性。,0.890,,1,X123,1,2025-12-08 00:00:00.0000000,
3105,27,8,Believe that I am better than others.,我相信自己比他人優越。,0.850,,1,"H736, X61",1,2025-12-08 00:00:00.0000000,
3106,27,8,Believe that others have good intentions.,我相信他人有善意。,0.850,,1,H549,1,2025-12-08 00:00:00.0000000,
3107,27,162,Believe that too much tax money goes to support artists.,我相信太多稅金用於支持藝術家。,0.890,,1,X20,1,2025-12-08 00:00:00.0000000,
3108,27,162,Can say things beautifully.,我能把話說得很漂亮。,0.890,,1,H1247,1,2025-12-08 00:00:00.0000000,
3109,27,34,Carry out my plans.,我執行我的計劃。,0.900,,1,H258,1,2025-12-08 00:00:00.0000000,
3110,27,162,Carry the conversation to a higher level.,我能將對話提升到更高層次。,0.890,,1,H1227,1,2025-12-08 00:00:00.0000000,
3111,27,64,Cheer people up.,我讓人們振作起來。,0.910,,1,H1151,1,2025-12-08 00:00:00.0000000,
3112,27,34,Complete tasks successfully.,我成功完成任務。,0.900,,1,H1285,1,2025-12-08 00:00:00.0000000,
3113,27,8,Contradict others.,我反駁他人。,0.850,,1,H808,1,2025-12-08 00:00:00.0000000,
3114,27,8,Cut others to pieces.,我會將他人批評得體無完膚。,0.850,,1,H422,1,2025-12-08 00:00:00.0000000,
3115,27,156,Dislike myself.,我不喜歡自己。,0.910,,1,X15,1,2025-12-08 00:00:00.0000000,
3116,27,34,Do just enough work to get by.,我只做足夠的工作。,0.900,,1,X115,1,2025-12-08 00:00:00.0000000,
3117,27,162,Do not enjoy going to art museums.,我不喜歡去美術館。,0.890,,1,X235,1,2025-12-08 00:00:00.0000000,
3118,27,162,Do not like art.,我不喜歡藝術。,0.890,,1,X86,1,2025-12-08 00:00:00.0000000,
3119,27,162,Do not like poetry.,我不喜歡詩歌。,0.890,,1,X45,1,2025-12-08 00:00:00.0000000,
3120,27,34,Don't put my mind on the task at hand.,我不把注意力放在手頭的任務上。,0.900,,1,H854,1,2025-12-08 00:00:00.0000000,
3121,27,34,Don't see things through.,我不會把事情做完。,0.900,,1,H885,1,2025-12-08 00:00:00.0000000,
3122,27,162,Enjoy hearing new ideas.,我喜歡聽到新想法。,0.890,,1,X166,1,2025-12-08 00:00:00.0000000,
3123,27,162,Enjoy thinking about things.,我喜歡思考事物。,0.890,,1,E145,1,2025-12-08 00:00:00.0000000,
3124,27,162,Enjoy wild flights of fantasy.,我喜歡狂野的幻想飛行。,0.890,,1,X238,1,2025-12-08 00:00:00.0000000,
3125,27,156,Fear for the worst.,我擔心最壞的情況。,0.910,,1,H999,1,2025-12-08 00:00:00.0000000,
3126,27,34,Finish what I start.,我完成我開始的事。,0.900,,1,H254,1,2025-12-08 00:00:00.0000000,
3127,27,34,Follow through with my plans.,我貫徹我的計劃。,0.900,,1,X196,1,2025-12-08 00:00:00.0000000,
3128,27,162,Get excited by new ideas.,我對新想法感到興奮。,0.890,,1,H5,1,2025-12-08 00:00:00.0000000,
3129,27,162,Have a rich vocabulary.,我的詞彙量很豐富。,0.890,,1,"H1276, X245",1,2025-12-08 00:00:00.0000000,
3130,27,8,Have a sharp tongue.,我說話尖酸刻薄。,0.850,,1,H917,1,2025-12-08 00:00:00.0000000,
3131,27,162,Have a vivid imagination.,我有生動的想像力。,0.890,,1,X14,1,2025-12-08 00:00:00.0000000,
3132,27,162,Have difficulty understanding abstract ideas.,我難以理解抽象概念。,0.890,,1,X176,1,2025-12-08 00:00:00.0000000,
3133,27,64,Keep others at a distance.,我與他人保持距離。,0.910,,1,H704,1,2025-12-08 00:00:00.0000000,
3134,27,34,Leave things unfinished.,我把事情留下未完成。,0.900,,1,H928,1,2025-12-08 00:00:00.0000000,
3135,27,8,Make demands on others.,我對他人提出要求。,0.850,,1,H2030,1,2025-12-08 00:00:00.0000000,
3136,27,34,Mess things up.,我把事情搞砸。,0.900,,1,H896,1,2025-12-08 00:00:00.0000000,
3137,27,34,Need a push to get started.,我需要推動才能開始。,0.900,,1,H969,1,2025-12-08 00:00:00.0000000,
3138,27,156,Often feel blue.,我經常感到憂鬱。,0.910,,1,X74,1,2025-12-08 00:00:00.0000000,
3139,27,162,Rarely look for a deeper meaning in things.,我很少尋找事物更深層的意義。,0.890,,1,E77,1,2025-12-08 00:00:00.0000000,
3140,27,156,Remain calm under pressure.,我在壓力下保持冷靜。,0.910,,1,X79,1,2025-12-08 00:00:00.0000000,
3141,27,8,Respect others.,我尊重他人。,0.850,,1,H105,1,2025-12-08 00:00:00.0000000,
3142,27,64,Retreat from others.,我遠離他人。,0.910,,1,H649,1,2025-12-08 00:00:00.0000000,
3143,27,156,Seldom get mad.,我很少生氣。,0.910,,1,X231,1,2025-12-08 00:00:00.0000000,
3144,27,8,Suspect hidden motives in others.,我懷疑他人有隱藏動機。,0.850,,1,H604,1,2025-12-08 00:00:00.0000000,
3145,27,162,Tend to vote for conservative political candidates.,我傾向於投票給保守的政治候選人。,0.890,,1,X126,1,2025-12-08 00:00:00.0000000,
3146,27,162,Tend to vote for liberal political candidates.,我傾向於投票給自由派的政治候選人。,0.890,,1,X218,1,2025-12-08 00:00:00.0000000,
3147,27,8,Treat all people equally.,我平等對待所有人。,0.850,,1,"H186, V94",1,2025-12-08 00:00:00.0000000,
3148,27,8,Trust what people say.,我相信人們所說的話。,0.850,,1,E157,1,2025-12-08 00:00:00.0000000,
3149,27,64,Warm up quickly to others.,我很快就能親近他人。,0.910,,1,"H52, X1",1,2025-12-08 00:00:00.0000000,
3150,28,39,Acted in a play.,在戲劇中演出。,0.690,,1,,1,2025-12-08 00:00:00.0000000,
3151,28,108,Ate candy.,吃糖果。,0.640,,1,,1,2025-12-08 00:00:00.0000000,
3152,28,183,Ate dinner alone.,獨自用餐。,0.730,,1,,1,2025-12-08 00:00:00.0000000,
3153,28,108,Ate food while walking or working.,邊走邊工作時吃東西。,0.640,,1,,1,2025-12-08 00:00:00.0000000,
3154,28,108,Ate in a restaurant.,在餐廳用餐。,0.640,,1,,1,2025-12-08 00:00:00.0000000,
3155,28,108,Ate or drank while driving.,開車時吃喝。,0.640,,1,,1,2025-12-08 00:00:00.0000000,
3156,28,108,Ate too much.,吃太多。,0.640,,1,,1,2025-12-08 00:00:00.0000000,
3157,28,40,Attended a ballet performance.,觀看芭蕾舞表演。,0.820,,1,,1,2025-12-08 00:00:00.0000000,
3158,28,222,Attended a church or religious service.,參加教堂或宗教儀式。,0.890,,1,,1,2025-12-08 00:00:00.0000000,
3159,28,119,Attended a formal dance.,參加正式舞會。,0.570,,1,,1,2025-12-08 00:00:00.0000000,
3160,28,40,Attended a public lecture.,參加公開講座。,0.820,,1,,1,2025-12-08 00:00:00.0000000,
3161,28,118,Attended a rally or demonstration.,參加集會或示威活動。,0.700,,1,,1,2025-12-08 00:00:00.0000000,
3162,28,40,Attended a stage play or musical.,觀看舞台劇或音樂劇。,0.820,,1,,1,2025-12-08 00:00:00.0000000,
3163,28,118,Attended a town meeting.,參加鎮民大會。,0.700,,1,,1,2025-12-08 00:00:00.0000000,
3164,28,123,Attended an athletic event.,參加體育賽事。,0.790,,1,,1,2025-12-08 00:00:00.0000000,
3165,28,40,Attended an opera or a concert.,參加歌劇或音樂會。,0.820,,1,,1,2025-12-08 00:00:00.0000000,
3166,28,112,"Baked a cake, pie, cookies, or bread.",烤蛋糕、派、餅乾或麵包。,0.750,,1,,1,2025-12-08 00:00:00.0000000,
3167,28,117,Bathed or groomed a pet animal.,為寵物洗澡或梳理毛髮。,0.840,,1,,1,2025-12-08 00:00:00.0000000,
3168,28,105,Became intoxicated.,喝醉酒。,0.840,,1,,1,2025-12-08 00:00:00.0000000,
3169,28,109,Bet money on a sports event.,為體育賽事下注。,0.790,,1,,1,2025-12-08 00:00:00.0000000,
3170,28,103,Bought a book about the things that I collect.,購買關於我收藏的書籍。,0.840,,1,,1,2025-12-08 00:00:00.0000000,
3171,28,144,Bought a book.,購買書籍。,0.750,,1,,1,2025-12-08 00:00:00.0000000,
3172,28,125,"Bought a car, truck or motorcycle.",購買汽車、卡車或摩托車。,0.500,,1,,1,2025-12-08 00:00:00.0000000,
3173,28,15,Bought a fashionable item of clothing.,購買時尚的衣服。,0.760,,1,,1,2025-12-08 00:00:00.0000000,
3174,28,120,Bought a self-help book.,購買自我成長書籍。,0.660,,1,,1,2025-12-08 00:00:00.0000000,
3175,28,111,Bought or picked flowers.,購買或採摘花朵。,0.850,,1,,1,2025-12-08 00:00:00.0000000,
3176,28,114,Bought or sold real estate.,買賣房地產。,0.750,,1,,1,2025-12-08 00:00:00.0000000,
3177,28,114,Bought or sold stocks or bonds.,買賣股票或債券。,0.750,,1,,1,2025-12-08 00:00:00.0000000,
3178,28,111,Bought plants for a garden or yard.,為花園或庭院購買植物。,0.850,,1,,1,2025-12-08 00:00:00.0000000,
3179,28,103,Bought something for my collection.,為我的收藏購買東西。,0.840,,1,,1,2025-12-08 00:00:00.0000000,
3180,28,121,Bought something other than groceries.,購買雜貨以外的東西。,0.660,,1,,1,2025-12-08 00:00:00.0000000,
3181,28,117,Cared for a pet animal.,照顧寵物。,0.840,,1,,1,2025-12-08 00:00:00.0000000,
3182,28,111,Cared for a potted plant.,照顧盆栽植物。,0.850,,1,,1,2025-12-08 00:00:00.0000000,
3183,28,106,Changed a habit to have less impact on the environment.,改變習慣以減少對環境的影響。,0.520,,1,,1,2025-12-08 00:00:00.0000000,
3184,28,121,Checked the sales ads in a newspaper.,查看報紙上的促銷廣告。,0.660,,1,,1,2025-12-08 00:00:00.0000000,
3185,28,108,Chewed gum.,嚼口香糖。,0.640,,1,,1,2025-12-08 00:00:00.0000000,
3186,28,183,Chose to spend a day by myself.,選擇獨自度過一天。,0.730,,1,,1,2025-12-08 00:00:00.0000000,
3187,28,112,Cleaned the house.,打掃房子。,0.750,,1,,1,2025-12-08 00:00:00.0000000,
3188,28,106,Composted food scraps or yard waste.,堆肥廚餘或庭院廢物。,0.520,,1,,1,2025-12-08 00:00:00.0000000,
3189,28,112,Cooked a meal.,煮飯。,0.750,,1,,1,2025-12-08 00:00:00.0000000,
3190,28,107,Did aerobic exercise.,做有氧運動。,0.850,,1,,1,2025-12-08 00:00:00.0000000,
3191,28,111,Did yard work.,做庭院工作。,0.850,,1,,1,2025-12-08 00:00:00.0000000,
3192,28,107,Did yoga or other movement exercises.,做瑜伽或其他運動。,0.850,,1,,1,2025-12-08 00:00:00.0000000,
3193,28,119,Dined by candle light.,燭光晚餐。,0.570,,1,,1,2025-12-08 00:00:00.0000000,
3194,28,222,Discussed religion or spirituality.,討論宗教或靈性。,0.890,,1,,1,2025-12-08 00:00:00.0000000,
3195,28,123,Discussed sports.,討論運動。,0.790,,1,,1,2025-12-08 00:00:00.0000000,
3196,28,118,Donated money to a political campaign or cause.,為政治競選或事業捐款。,0.700,,1,,1,2025-12-08 00:00:00.0000000,
3197,28,118,Donated money to charity.,捐款給慈善機構。,0.700,,1,,1,2025-12-08 00:00:00.0000000,
3198,28,115,Downloaded music from the Internet.,從網路下載音樂。,0.770,,1,,1,2025-12-08 00:00:00.0000000,
3199,28,105,Drank beer or wine.,喝啤酒或葡萄酒。,0.840,,1,,1,2025-12-08 00:00:00.0000000,
3200,28,105,Drank in a bar or night club.,在酒吧或夜總會喝酒。,0.840,,1,,1,2025-12-08 00:00:00.0000000,
3201,28,105,"Drank whiskey, vodka, gin, or other hard liquor.",喝威士忌、伏特加、琴酒或其他烈酒。,0.840,,1,,1,2025-12-08 00:00:00.0000000,
3202,28,120,Enrolled in a course of study.,註冊學習課程。,0.660,,1,,1,2025-12-08 00:00:00.0000000,
3203,28,117,Entertained six or more people.,招待六人或更多人。,0.820,,1,,1,2025-12-08 00:00:00.0000000,
3204,28,107,Exercised for 40 minutes or longer.,運動40分鐘或更長時間。,0.850,,1,,1,2025-12-08 00:00:00.0000000,
3205,28,117,Fed a pet animal.,餵養寵物。,0.840,,1,,1,2025-12-08 00:00:00.0000000,
3206,28,109,Gambled on a slot machine or video poker game.,在老虎機或電子撲克機上賭博。,0.790,,1,,1,2025-12-08 00:00:00.0000000,
3207,28,109,Gambled with cards or dice.,用紙牌或骰子賭博。,0.790,,1,,1,2025-12-08 00:00:00.0000000,
3208,28,111,Gardened.,做園藝。,0.850,,1,,1,2025-12-08 00:00:00.0000000,
3209,28,222,Gave a blessing at a meal.,在餐前祈禱。,0.890,,1,,1,2025-12-08 00:00:00.0000000,
3210,28,105,Had a hangover.,宿醉。,0.840,,1,,1,2025-12-08 00:00:00.0000000,
3211,28,77,Had someone over for dinner.,邀請某人來家裡吃晚飯。,0.820,,1,,1,2025-12-08 00:00:00.0000000,
3212,28,112,Ironed linens or clothes.,燙亞麻布或衣服。,0.750,,1,,1,2025-12-08 00:00:00.0000000,
3213,28,112,"Knitted, quilted, sewed, or crocheted.",編織、拼布、縫紉或鉤針編織。,0.750,,1,,1,2025-12-08 00:00:00.0000000,
3214,28,110,Learned a new board or card game.,學習新的桌遊或紙牌遊戲。,0.650,,1,,1,2025-12-08 00:00:00.0000000,
3215,28,120,Learned a new skill.,學習新技能。,0.660,,1,,1,2025-12-08 00:00:00.0000000,
3216,28,102,Let a child win a game.,讓孩子贏得遊戲。,0.860,,1,,1,2025-12-08 00:00:00.0000000,
3217,28,107,Lifted weights.,舉重。,0.850,,1,,1,2025-12-08 00:00:00.0000000,
3218,28,222,Listened to a religious program on the radio or TV.,在收音機或電視上收聽宗教節目。,0.890,,1,,1,2025-12-08 00:00:00.0000000,
3219,28,115,Listened to music on the radio.,在收音機上聽音樂。,0.770,,1,,1,2025-12-08 00:00:00.0000000,
3220,28,115,Listened to music while working.,工作時聽音樂。,0.770,,1,,1,2025-12-08 00:00:00.0000000,
3221,28,143,Looked something up in an encyclopedia.,在百科全書中查找資料。,0.610,,1,,1,2025-12-08 00:00:00.0000000,
3222,28,143,Looked up a word in a dictionary.,在字典中查字。,0.610,,1,,1,2025-12-08 00:00:00.0000000,
3223,28,104,Looked up information on the Internet.,在網路上查找資訊。,0.890,,1,,1,2025-12-08 00:00:00.0000000,
3224,28,112,Made a bed.,鋪床。,0.750,,1,,1,2025-12-08 00:00:00.0000000,
3225,28,113,Made an entry in a diary or journal.,在日記或日誌中記錄。,0.600,,1,,1,2025-12-08 00:00:00.0000000,
3226,28,122,Made an entry on a personal web-page.,在個人網頁上發表文章。,0.690,,1,,1,2025-12-08 00:00:00.0000000,
3227,28,114,Obtained stock market prices.,獲取股市價格。,0.750,,1,,1,2025-12-08 00:00:00.0000000,
3228,28,108,Ordered food to be delivered.,訂購外送食物。,0.640,,1,,1,2025-12-08 00:00:00.0000000,
3229,28,39,Painted a picture.,畫畫。,0.690,,1,,1,2025-12-08 00:00:00.0000000,
3230,28,107,Participated in an exercise program.,參加運動計畫。,0.850,,1,,1,2025-12-08 00:00:00.0000000,
3231,28,122,Participated in an online discussion group.,參加線上討論小組。,0.690,,1,,1,2025-12-08 00:00:00.0000000,
3232,28,106,Picked up litter.,撿垃圾。,0.520,,1,,1,2025-12-08 00:00:00.0000000,
3233,28,77,Planned a party.,計劃派對。,0.820,,1,,1,2025-12-08 00:00:00.0000000,
3234,28,111,Planted or transplanted a plant.,種植或移植植物。,0.850,,1,,1,2025-12-08 00:00:00.0000000,
3235,28,110,Played a board game.,玩桌遊。,0.650,,1,,1,2025-12-08 00:00:00.0000000,
3236,28,104,Played a computer game.,玩電腦遊戲。,0.890,,1,,1,2025-12-08 00:00:00.0000000,
3237,28,39,Played a musical instrument.,演奏樂器。,0.690,,1,,1,2025-12-08 00:00:00.0000000,
3238,28,123,Played a team sport.,參加團隊運動。,0.790,,1,,1,2025-12-08 00:00:00.0000000,
3239,28,123,Played basketball.,打籃球。,0.790,,1,,1,2025-12-08 00:00:00.0000000,
3240,28,109,Played bingo for money.,玩賓果遊戲賭錢。,0.790,,1,,1,2025-12-08 00:00:00.0000000,
3241,28,110,Played cards.,打牌。,0.650,,1,,1,2025-12-08 00:00:00.0000000,
3242,28,110,Played chess or checkers.,下棋或西洋跳棋。,0.650,,1,,1,2025-12-08 00:00:00.0000000,
3243,28,123,Played tennis or golf.,打網球或高爾夫球。,0.790,,1,,1,2025-12-08 00:00:00.0000000,
3244,28,102,Played with a child.,和孩子玩耍。,0.860,,1,,1,2025-12-08 00:00:00.0000000,
3245,28,117,Played with a pet animal.,和寵物玩耍。,0.840,,1,,1,2025-12-08 00:00:00.0000000,
3246,28,222,Prayed (not including blessings at meals).,祈禱（不包括餐前祝福）。,0.890,,1,,1,2025-12-08 00:00:00.0000000,
3247,28,39,Produced a work of art.,創作藝術作品。,0.690,,1,,1,2025-12-08 00:00:00.0000000,
3248,28,114,Purchased a commodity as an investment.,購買商品作為投資。,0.750,,1,,1,2025-12-08 00:00:00.0000000,
3249,28,115,Purchased a musical album.,購買音樂專輯。,0.770,,1,,1,2025-12-08 00:00:00.0000000,
3250,28,117,Purchased a pet animal.,購買寵物。,0.840,,1,,1,2025-12-08 00:00:00.0000000,
3251,28,109,Purchased a scratch ticket.,購買刮刮樂彩票。,0.790,,1,,1,2025-12-08 00:00:00.0000000,
3252,28,113,Put pictures in a photo album.,把照片放進相簿。,0.600,,1,,1,2025-12-08 00:00:00.0000000,
3253,28,125,"Raced a car, truck or motorcycle.",賽車、卡車或摩托車。,0.500,,1,,1,2025-12-08 00:00:00.0000000,
3254,28,222,Read a book about religion or spirituality.,閱讀關於宗教或靈性的書籍。,0.890,,1,,1,2025-12-08 00:00:00.0000000,
3255,28,103,Read a book about the things that I collect.,閱讀關於我收藏的書籍。,0.840,,1,,1,2025-12-08 00:00:00.0000000,
3256,28,114,Read a book on a financial topic.,閱讀財經主題的書籍。,0.750,,1,,1,2025-12-08 00:00:00.0000000,
3257,28,144,Read a book.,閱讀書籍。,0.750,,1,,1,2025-12-08 00:00:00.0000000,
3258,28,125,Read a car magazine or book.,閱讀汽車雜誌或書籍。,0.500,,1,,1,2025-12-08 00:00:00.0000000,
3259,28,15,Read a fashion-related book.,閱讀時尚相關書籍。,0.760,,1,,1,2025-12-08 00:00:00.0000000,
3260,28,15,Read a fashion-related magazine.,閱讀時尚相關雜誌。,0.760,,1,,1,2025-12-08 00:00:00.0000000,
3261,28,143,Read a news magazine.,閱讀新聞雜誌。,0.610,,1,,1,2025-12-08 00:00:00.0000000,
3262,28,120,Read a self-help book.,閱讀自我成長書籍。,0.660,,1,,1,2025-12-08 00:00:00.0000000,
3263,28,102,Read a story to a child.,為孩子讀故事。,0.860,,1,,1,2025-12-08 00:00:00.0000000,
3264,28,144,Read an entire book in one sitting.,一次看完整本書。,0.750,,1,,1,2025-12-08 00:00:00.0000000,
3265,28,144,Read in bed before going to sleep.,睡前在床上閱讀。,0.750,,1,,1,2025-12-08 00:00:00.0000000,
3266,28,115,Read music-related news.,閱讀音樂相關新聞。,0.770,,1,,1,2025-12-08 00:00:00.0000000,
3267,28,104,Read news on the Internet.,在網路上閱讀新聞。,0.890,,1,,1,2025-12-08 00:00:00.0000000,
3268,28,121,Read newspaper ads for non-grocery items.,閱讀報紙上非雜貨商品的廣告。,0.660,,1,,1,2025-12-08 00:00:00.0000000,
3269,28,143,Read poetry.,閱讀詩歌。,0.610,,1,,1,2025-12-08 00:00:00.0000000,
3270,28,122,Read someone��s personal web-page.,閱讀某人的個人網頁。,0.690,,1,,1,2025-12-08 00:00:00.0000000,
3271,28,222,Read the Bible or other sacred text.,閱讀聖經或其他神聖文本。,0.890,,1,,1,2025-12-08 00:00:00.0000000,
3272,28,102,Read the comics to a child.,為孩子朗讀漫畫。,0.860,,1,,1,2025-12-08 00:00:00.0000000,
3273,28,143,Read the editorial page of a newspaper.,閱讀報紙的社論版。,0.610,,1,,1,2025-12-08 00:00:00.0000000,
3274,28,126,Recorded a television program.,錄製電視節目。,0.610,,1,,1,2025-12-08 00:00:00.0000000,
3275,28,106,Recycled one or more items.,回收一個或多個物品。,0.520,,1,,1,2025-12-08 00:00:00.0000000,
3276,28,125,Rode a motorcycle.,騎摩托車。,0.500,,1,,1,2025-12-08 00:00:00.0000000,
3277,28,39,Sang or played an instrument in public.,在公開場合唱歌或演奏樂器。,0.690,,1,,1,2025-12-08 00:00:00.0000000,
3278,28,104,Sent a message by electronic mail (e-mail).,發送電子郵件。,0.890,,1,,1,2025-12-08 00:00:00.0000000,
3279,28,102,Served as a baby sitter.,擔任保姆。,0.860,,1,,1,2025-12-08 00:00:00.0000000,
3280,28,115,Shopped in a music store.,在音樂商店購物。,0.770,,1,,1,2025-12-08 00:00:00.0000000,
3281,28,121,Shopped on the web.,在網路上購物。,0.660,,1,,1,2025-12-08 00:00:00.0000000,
3282,28,118,Signed a petition.,簽署請願書。,0.700,,1,,1,2025-12-08 00:00:00.0000000,
3283,28,121,Spent 10 minutes or more in a non-grocery store.,在非雜貨商店待10分鐘或更長時間。,0.660,,1,,1,2025-12-08 00:00:00.0000000,
3284,28,183,Spent an entire vacation by myself.,獨自度過整個假期。,0.730,,1,,1,2025-12-08 00:00:00.0000000,
