1113,5,58,Believe that criminals should receive help rather than punishment.,我相信罪犯應該得到幫助而不是懲罰。,0.640,0.800,1,X219,1,2025-12-08 00:00:00.0000000,
1114,5,58,Believe that the poor deserve our sympathy.,我相信窮人值得我們同情。,0.640,0.800,1,A24,1,2025-12-08 00:00:00.0000000,
1115,5,154,Can't help but look upset when something bad happens.,當不好的事情發生時，我忍不住看起來很沮喪。,0.750,0.740,1,A14,1,2025-12-08 00:00:00.0000000,
1116,5,190,Dislike being around happy people when I'm feeling sad.,當我感到悲傷時，我不喜歡和快樂的人在一起。,0.730,0.700,1,A2,1,2025-12-08 00:00:00.0000000,
1117,5,190,Dislike children's birthday parties.,我不喜歡兒童生日派對。,0.730,0.700,1,A42,1,2025-12-08 00:00:00.0000000,
1118,5,58,Don't like to get involved in other people's problems.,我不喜歡捲入他人的問題。,0.640,0.800,1,X103,1,2025-12-08 00:00:00.0000000,
1119,5,173,Express my affection physically.,我用身體表達我的愛。,0.810,0.790,1,H24,1,2025-12-08 00:00:00.0000000,
1120,5,173,Express my happiness in a childlike manner.,我以童真的方式表達我的快樂。,0.810,0.790,1,A7,1,2025-12-08 00:00:00.0000000,
1121,5,58,Feel little concern for others.,我很少關心他人。,0.640,0.800,1,X244,1,2025-12-08 00:00:00.0000000,
1122,5,190,Feel other people's joy.,我感受到他人的喜悅。,0.730,0.700,1,A63,1,2025-12-08 00:00:00.0000000,
1123,5,58,Feel sympathy for those who are worse off than myself.,我同情那些比我更不幸的人。,0.640,0.800,1,,1,2025-12-08 00:00:00.0000000,
1124,5,173,Find it difficult showing people that I care about them.,我發現很難向人們表達我對他們的關心。,0.810,0.790,1,A4,1,2025-12-08 00:00:00.0000000,
1125,5,154,Find it difficult showing people that I'm angry with them.,我發現很難向人們表達我對他們的憤怒。,0.750,0.740,1,A12,1,2025-12-08 00:00:00.0000000,
1126,5,190,Find it hard to stay in a bad mood if the people around me are happy.,如果周圍的人都很快樂，我很難保持壞心情。,0.730,0.700,1,A76,1,2025-12-08 00:00:00.0000000,
1127,5,190,Get caught up in the excitement when others are celebrating.,當他人慶祝時，我會被興奮感染。,0.730,0.700,1,A71,1,2025-12-08 00:00:00.0000000,
1128,5,173,Have difficulty showing affection.,我難以表達愛意。,0.810,0.790,1,A132,1,2025-12-08 00:00:00.0000000,
1129,5,58,Have little sympathy for the unemployed.,我對失業者幾乎沒有同情心。,0.640,0.800,1,A51,1,2025-12-08 00:00:00.0000000,
1130,5,58,Have no sympathy for criminals.,我對罪犯沒有同情心。,0.640,0.800,1,E169,1,2025-12-08 00:00:00.0000000,
1131,5,173,Hug my close friends.,我擁抱我的密友。,0.810,0.790,1,A79,1,2025-12-08 00:00:00.0000000,
1132,5,154,"Keep my feelings to myself, regardless of how scared I am.",無論我有多害怕，我都會把感受藏在心裡。,0.750,0.740,1,A130,1,2025-12-08 00:00:00.0000000,
1133,5,154,"Keep my feelings to myself, regardless of how unhappy I am.",無論我有多不開心，我都會把感受藏在心裡。,0.750,0.740,1,A10,1,2025-12-08 00:00:00.0000000,
1134,5,173,Keep my happy feelings to myself.,我把快樂的感受藏在心裡。,0.810,0.790,1,A84,1,2025-12-08 00:00:00.0000000,
1135,5,173,Laugh out loud if something is funny.,如果有趣的事我會大笑。,0.810,0.790,1,A5,1,2025-12-08 00:00:00.0000000,
1136,5,190,Like to watch children open presents.,我喜歡看孩子打開禮物。,0.730,0.700,1,A1,1,2025-12-08 00:00:00.0000000,
1137,5,54,Listen to my brain rather than my heart.,我聽從大腦而不是內心。,0.730,0.670,1,H378,1,2025-12-08 00:00:00.0000000,
1138,5,54,Listen to my feelings when making important decisions.,我在做重要決定時聽從我的感受。,0.730,0.670,1,A15,1,2025-12-08 00:00:00.0000000,
1139,5,54,Listen to my heart rather than my brain.,我聽從內心而不是大腦。,0.730,0.670,1,X199,1,2025-12-08 00:00:00.0000000,
1140,5,58,Look down on any weakness.,我輕視任何弱點。,0.640,0.800,1,H435,1,2025-12-08 00:00:00.0000000,
1141,5,54,"Make decisions based on facts, not feelings.",我基於事實而非感受做決定。,0.730,0.670,1,A113,1,2025-12-08 00:00:00.0000000,
1142,5,17,Notice my emotions.,我注意到我的情緒。,0.810,0.830,1,A134,1,2025-12-08 00:00:00.0000000,
1143,5,17,Often ignore my feelings.,我經常忽視我的感受。,0.810,0.830,1,X183,1,2025-12-08 00:00:00.0000000,
1144,5,17,Often stop to analyze how I'm feeling.,我經常停下來分析自己的感受。,0.810,0.830,1,A142,1,2025-12-08 00:00:00.0000000,
1145,5,17,Pay a lot of attention to my feelings.,我非常關注我的感受。,0.810,0.830,1,A116,1,2025-12-08 00:00:00.0000000,
1146,5,54,Plan my life based on how I feel.,我根據自己的感受規劃我的生活。,0.730,0.670,1,A69,1,2025-12-08 00:00:00.0000000,
1147,5,54,Plan my life logically.,我有邏輯地規劃我的生活。,0.730,0.670,1,A97,1,2025-12-08 00:00:00.0000000,
1148,5,17,Rarely analyze my emotions.,我很少分析我的情緒。,0.810,0.830,1,A106,1,2025-12-08 00:00:00.0000000,
1149,5,189,Rarely cry during sad movies.,我很少在悲傷的電影中哭泣。,0.590,0.630,1,A56,1,2025-12-08 00:00:00.0000000,
1150,5,190,Rarely get caught up in the excitement.,我很少被興奮感染。,0.730,0.700,1,A13,1,2025-12-08 00:00:00.0000000,
1151,5,17,Rarely notice my emotional reactions.,我很少注意到自己的情緒反應。,0.810,0.830,1,X10,1,2025-12-08 00:00:00.0000000,
1152,5,154,Rarely show my anger.,我很少表現出憤怒。,0.750,0.740,1,A66,1,2025-12-08 00:00:00.0000000,
1153,5,17,Rarely think about how I feel.,我很少思考自己的感受。,0.810,0.830,1,A87,1,2025-12-08 00:00:00.0000000,
1154,5,189,Remain calm during emergencies.,我在緊急情況下保持冷靜。,0.590,0.630,1,A128,1,2025-12-08 00:00:00.0000000,
1155,5,154,Shout or scream when I'm angry.,當我生氣時我會大喊或尖叫。,0.750,0.740,1,A3,1,2025-12-08 00:00:00.0000000,
1156,5,154,Show my fear.,我表現出我的恐懼。,0.750,0.740,1,A54,1,2025-12-08 00:00:00.0000000,
1157,5,173,Show my feelings when I'm happy.,當我快樂時我會表現出我的感受。,0.810,0.790,1,A139,1,2025-12-08 00:00:00.0000000,
1158,5,154,Show my sadness.,我表現出我的悲傷。,0.750,0.740,1,A101,1,2025-12-08 00:00:00.0000000,
1159,5,173,Sometimes laugh out loud when reading or watching TV.,我有時在閱讀或看電視時會大笑。,0.810,0.790,1,A48,1,2025-12-08 00:00:00.0000000,
1160,5,189,Suffer from others' sorrows.,我為他人的悲傷而受苦。,0.590,0.630,1,"H988, X65",1,2025-12-08 00:00:00.0000000,
1161,5,154,Suspect that my facial expressions give me away when I feel sad.,我懷疑當我感到悲傷時，我的面部表情會洩露我。,0.750,0.740,1,A80,1,2025-12-08 00:00:00.0000000,
1162,5,58,Sympathize with the homeless.,我同情無家可歸者。,0.640,0.800,1,X259,1,2025-12-08 00:00:00.0000000,
1163,5,17,Think about the causes of my emotions.,我思考我情緒的原因。,0.810,0.830,1,A33,1,2025-12-08 00:00:00.0000000,
1164,5,190,Usually end up laughing if the people around me are laughing.,如果周圍的人在笑，我通常也會笑。,0.730,0.700,1,A16,1,2025-12-08 00:00:00.0000000,
1165,5,154,Wish I could more easily show my negative feelings.,我希望我能更容易地表達我的負面感受。,0.750,0.740,1,A28,1,2025-12-08 00:00:00.0000000,
1166,5,189,Would be upset if I saw an injured animal.,如果我看到受傷的動物，我會感到難過。,0.590,0.630,1,A46,1,2025-12-08 00:00:00.0000000,
1167,6,93,Always know what I am doing.,我總是知道自己在做什麼。,0.810,,1,P427,1,2025-12-08 00:00:00.0000000,
1168,6,156,Am a person whose moods go up and down easily.,我是個情緒起伏的人。,0.890,,1,,1,2025-12-08 00:00:00.0000000,
1169,6,12,Am a person whose moods go up and down easily.,我是個情緒起伏的人。,0.890,,1,,1,2025-12-08 00:00:00.0000000,
1170,6,156,Am afraid of many things.,我害怕很多事情。,0.890,,1,H968,1,2025-12-08 00:00:00.0000000,
1171,6,14,Am afraid of many things.,我害怕很多事情。,0.840,,1,H968,1,2025-12-08 00:00:00.0000000,
1172,6,156,Am easily discouraged.,我容易感到沮喪。,0.890,,1,H647,1,2025-12-08 00:00:00.0000000,
1173,6,14,Am easily discouraged.,我容易感到沮喪。,0.840,,1,H647,1,2025-12-08 00:00:00.0000000,
1174,6,93,Am easily distracted.,我容易分心。,0.810,,1,"H843, F44, T192",1,2025-12-08 00:00:00.0000000,
1175,6,156,Am filled with doubts about things.,我對事情充滿疑慮。,0.890,,1,H683,1,2025-12-08 00:00:00.0000000,
1176,6,14,Am filled with doubts about things.,我對事情充滿疑慮。,0.840,,1,H683,1,2025-12-08 00:00:00.0000000,
1177,6,242,Am hard to get to know.,我很難被了解。,0.810,,1,"H596, X9",1,2025-12-08 00:00:00.0000000,
1178,6,29,Am indifferent to the feelings of others.,我對他人的感受漠不關心。,0.840,,1,X203,1,2025-12-08 00:00:00.0000000,
1179,6,242,Am not a very enthusiastic person.,我不是個很有熱情的人。,0.810,,1,Y1,1,2025-12-08 00:00:00.0000000,
1180,6,156,Am not easily annoyed.,我不容易被激怒。,0.890,,1,X23,1,2025-12-08 00:00:00.0000000,
1181,6,12,Am not easily annoyed.,我不容易被激怒。,0.890,,1,X23,1,2025-12-08 00:00:00.0000000,
1182,6,156,Am not embarrassed easily.,我不容易感到尷尬。,0.890,,1,X242,1,2025-12-08 00:00:00.0000000,
1183,6,14,Am not embarrassed easily.,我不容易感到尷尬。,0.840,,1,X242,1,2025-12-08 00:00:00.0000000,
1184,6,29,Am not interested in other people��s problems.,我對他人的問題不感興趣。,0.840,,1,,1,2025-12-08 00:00:00.0000000,
1185,6,173,Am out for my own personal gain.,我是為了自己的個人利益。,0.750,,1,H1325,1,2025-12-08 00:00:00.0000000,
1186,6,99,Am quick to understand things.,我能快速理解事物。,0.840,,1,X100,1,2025-12-08 00:00:00.0000000,
1187,6,98,Am quick to understand things.,我能快速理解事物。,0.840,,1,X100,1,2025-12-08 00:00:00.0000000,
1188,6,16,Am the first to act.,我是第一個行動的人。,0.850,,1,,1,2025-12-08 00:00:00.0000000,
1189,6,99,Avoid difficult reading material.,我避免閱讀困難的材料。,0.840,,1,X109,1,2025-12-08 00:00:00.0000000,
1190,6,173,Avoid imposing my will on others.,我避免把我的意志強加於他人。,0.750,,1,Q178,1,2025-12-08 00:00:00.0000000,
1191,6,99,Avoid philosophical discussions.,我避免哲學討論。,0.840,,1,X248,1,2025-12-08 00:00:00.0000000,
1192,6,98,Avoid philosophical discussions.,我避免哲學討論。,0.840,,1,X248,1,2025-12-08 00:00:00.0000000,
1193,6,156,Become overwhelmed by events.,我被事件壓倒。,0.890,,1,H959,1,2025-12-08 00:00:00.0000000,
1194,6,14,Become overwhelmed by events.,我被事件壓倒。,0.840,,1,H959,1,2025-12-08 00:00:00.0000000,
1195,6,99,Believe in the importance of art.,我相信藝術的重要性。,0.780,,1,X123,1,2025-12-08 00:00:00.0000000,
1196,6,6,Believe in the importance of art.,我相信藝術的重要性。,0.780,,1,X123,1,2025-12-08 00:00:00.0000000,
1197,6,173,Believe that I am better than others.,我相信自己比他人優越。,0.750,,1,"H736, X61",1,2025-12-08 00:00:00.0000000,
1198,6,156,Can be stirred up easily.,我容易被激動。,0.890,,1,H921,1,2025-12-08 00:00:00.0000000,
1199,6,12,Can be stirred up easily.,我容易被激動。,0.890,,1,H921,1,2025-12-08 00:00:00.0000000,
1200,6,99,Can handle a lot of information.,我能處理大量資訊。,0.840,,1,H1322,1,2025-12-08 00:00:00.0000000,
1201,6,98,Can handle a lot of information.,我能處理大量資訊。,0.840,,1,H1322,1,2025-12-08 00:00:00.0000000,
1202,6,16,Can talk others into doing things.,我能說服他人做事。,0.850,,1,H1137,1,2025-12-08 00:00:00.0000000,
1203,6,29,Can��t be bothered with other��s needs.,我不關心他人的需求。,0.840,,1,,1,2025-12-08 00:00:00.0000000,
1204,6,93,Carry out my plans.,我執行我的計劃。,0.810,,1,H258,1,2025-12-08 00:00:00.0000000,
1205,6,156,Change my mood a lot.,我的心情經常變化。,0.890,,1,H926,1,2025-12-08 00:00:00.0000000,
1206,6,12,Change my mood a lot.,我的心情經常變化。,0.890,,1,H926,1,2025-12-08 00:00:00.0000000,
1207,6,16,Do not have an assertive personality.,我沒有自信堅定的個性。,0.850,,1,,1,2025-12-08 00:00:00.0000000,
1208,6,99,Do not like poetry.,我不喜歡詩歌。,0.780,,1,X45,1,2025-12-08 00:00:00.0000000,
1209,6,6,Do not like poetry.,我不喜歡詩歌。,0.780,,1,X45,1,2025-12-08 00:00:00.0000000,
1210,6,29,Don��t have a soft side.,我沒有柔軟的一面。,0.840,,1,,1,2025-12-08 00:00:00.0000000,
1211,6,93,Don��t put my mind on the task at hand.,我不把注意力放在手頭的任務上。,0.810,,1,,1,2025-12-08 00:00:00.0000000,
1212,6,99,Enjoy the beauty of nature.,我喜歡大自然的美。,0.780,,1,"W15, X261",1,2025-12-08 00:00:00.0000000,
1213,6,6,Enjoy the beauty of nature.,我喜歡大自然的美。,0.780,,1,"W15, X261",1,2025-12-08 00:00:00.0000000,
1214,6,156,Feel comfortable with myself.,我對自己感到自在。,0.890,,1,X129,1,2025-12-08 00:00:00.0000000,
1215,6,14,Feel comfortable with myself.,我對自己感到自在。,0.840,,1,X129,1,2025-12-08 00:00:00.0000000,
1216,6,29,Feel others�� emotions.,我能感受他人的情緒。,0.840,,1,,1,2025-12-08 00:00:00.0000000,
1217,6,156,Feel threatened easily.,我容易感到威脅。,0.890,,1,H612,1,2025-12-08 00:00:00.0000000,
1218,6,93,Find it difficult to get down to work.,我發現很難開始工作。,0.810,,1,H1171,1,2025-12-08 00:00:00.0000000,
1219,6,93,Finish what I start.,我完成我開始的事。,0.810,,1,H254,1,2025-12-08 00:00:00.0000000,
1220,6,99,Formulate ideas clearly.,我清晰地表達想法。,0.840,,1,H1219,1,2025-12-08 00:00:00.0000000,
1221,6,98,Formulate ideas clearly.,我清晰地表達想法。,0.840,,1,H1219,1,2025-12-08 00:00:00.0000000,
1222,6,156,Get angry easily.,我容易生氣。,0.890,,1,"H754, X18",1,2025-12-08 00:00:00.0000000,
1223,6,12,Get angry easily.,我容易生氣。,0.890,,1,"H754, X18",1,2025-12-08 00:00:00.0000000,
1224,6,99,Get deeply immersed in music.,我深深沉浸於音樂中。,0.780,,1,Q51,1,2025-12-08 00:00:00.0000000,
1225,6,6,Get deeply immersed in music.,我深深沉浸於音樂中。,0.780,,1,Q51,1,2025-12-08 00:00:00.0000000,
1226,6,156,Get easily agitated.,我容易激動。,0.890,,1,Q77,1,2025-12-08 00:00:00.0000000,
1227,6,12,Get easily agitated.,我容易激動。,0.890,,1,Q77,1,2025-12-08 00:00:00.0000000,
1228,6,93,Get things done quickly.,我快速完成事情。,0.810,,1,H555,1,2025-12-08 00:00:00.0000000,
1229,6,156,Get upset easily.,我容易沮喪。,0.890,,1,X95,1,2025-12-08 00:00:00.0000000,
1230,6,12,Get upset easily.,我容易沮喪。,0.890,,1,X95,1,2025-12-08 00:00:00.0000000,
1231,6,173,Hate to seem pushy.,我討厭看起來咄咄逼人。,0.750,,1,E31,1,2025-12-08 00:00:00.0000000,
1232,6,242,Have a lot of fun.,我玩得很開心。,0.810,,1,H1094,1,2025-12-08 00:00:00.0000000,
1233,6,99,Have a rich vocabulary.,我的詞彙量很豐富。,0.840,,1,"H1276, X245",1,2025-12-08 00:00:00.0000000,
1234,6,16,Have a strong personality.,我有強烈的個性。,0.850,,1,Q14,1,2025-12-08 00:00:00.0000000,
1235,6,99,Have difficulty understanding abstract ideas.,我難以理解抽象概念。,0.840,,1,X176,1,2025-12-08 00:00:00.0000000,
1236,6,16,Hold back my opinions.,我保留自己的意見。,0.850,,1,H679,1,2025-12-08 00:00:00.0000000,
1237,6,29,Inquire about others' well-being.,我關心他人的健康。,0.840,,1,H225,1,2025-12-08 00:00:00.0000000,
1238,6,173,Insult people.,我侮辱他人。,0.750,,1,H1103,1,2025-12-08 00:00:00.0000000,
1239,6,156,Keep my emotions under control.,我控制自己的情緒。,0.890,,1,H381,1,2025-12-08 00:00:00.0000000,
1240,6,12,Keep my emotions under control.,我控制自己的情緒。,0.890,,1,H381,1,2025-12-08 00:00:00.0000000,
1241,6,242,Keep others at a distance.,我與他人保持距離。,0.810,,1,H704,1,2025-12-08 00:00:00.0000000,
1242,6,163,Keep things tidy.,我保持東西整潔。,0.800,,1,Q104,1,2025-12-08 00:00:00.0000000,
1243,6,16,Know how to captivate people.,我知道如何吸引人。,0.850,,1,H1110,1,2025-12-08 00:00:00.0000000,
1244,6,16,Lack the talent for influencing people.,我缺乏影響他人的才能。,0.850,,1,P346,1,2025-12-08 00:00:00.0000000,
1245,6,242,Laugh a lot.,我經常笑。,0.810,,1,Q138,1,2025-12-08 00:00:00.0000000,
1246,6,99,Learn things slowly.,我學得很慢。,0.840,,1,Q67,1,2025-12-08 00:00:00.0000000,
1247,6,98,Learn things slowly.,我學得很慢。,0.840,,1,Q67,1,2025-12-08 00:00:00.0000000,
1248,6,29,Like to do things for others.,我喜歡為他人做事。,0.840,,1,H109,1,2025-12-08 00:00:00.0000000,
1249,6,99,Like to solve complex problems.,我喜歡解決複雜的問題。,0.840,,1,X201,1,2025-12-08 00:00:00.0000000,
1250,6,98,Like to solve complex problems.,我喜歡解決複雜的問題。,0.840,,1,X201,1,2025-12-08 00:00:00.0000000,
1251,6,173,Love a good fight.,我喜歡好的戰鬥。,0.750,,1,H453,1,2025-12-08 00:00:00.0000000,
1252,6,99,Love to reflect on things.,我喜愛反思事物。,0.780,,1,H1210,1,2025-12-08 00:00:00.0000000,
1253,6,6,Love to reflect on things.,我喜愛反思事物。,0.780,,1,H1210,1,2025-12-08 00:00:00.0000000,
1254,6,242,Make friends easily.,我很容易交朋友。,0.810,,1,H29,1,2025-12-08 00:00:00.0000000,
1255,6,93,Mess things up.,我把事情搞砸。,0.810,,1,H896,1,2025-12-08 00:00:00.0000000,
1256,6,99,Need a creative outlet.,我需要創意出口。,0.780,,1,E87,1,2025-12-08 00:00:00.0000000,
1257,6,6,Need a creative outlet.,我需要創意出口。,0.780,,1,E87,1,2025-12-08 00:00:00.0000000,
1258,6,93,Postpone decisions.,我推遲決定。,0.810,,1,H1180,1,2025-12-08 00:00:00.0000000,
1259,6,156,Rarely feel depressed.,我很少感到沮喪。,0.890,,1,D87,1,2025-12-08 00:00:00.0000000,
1260,6,14,Rarely feel depressed.,我很少感到沮喪。,0.840,,1,D87,1,2025-12-08 00:00:00.0000000,
1261,6,242,Rarely get caught up in the excitement.,我很少被興奮感染。,0.810,,1,A13,1,2025-12-08 00:00:00.0000000,
1262,6,156,Rarely get irritated.,我很少感到煩躁。,0.890,,1,X265,1,2025-12-08 00:00:00.0000000,
1263,6,12,Rarely get irritated.,我很少感到煩躁。,0.890,,1,X265,1,2025-12-08 00:00:00.0000000,
1264,6,156,Rarely lose my composure.,我很少失去鎮定。,0.890,,1,E99,1,2025-12-08 00:00:00.0000000,
1265,6,12,Rarely lose my composure.,我很少失去鎮定。,0.890,,1,E99,1,2025-12-08 00:00:00.0000000,
1266,6,173,Rarely put people under pressure.,我很少給人施加壓力。,0.750,,1,,1,2025-12-08 00:00:00.0000000,
1267,6,173,Respect authority.,我尊重權威。,0.750,,1,H296,1,2025-12-08 00:00:00.0000000,
1268,6,242,Reveal little about myself.,我很少透露自己的事。,0.810,,1,H601,1,2025-12-08 00:00:00.0000000,
1269,6,99,See beauty in things that others might not notice.,我看到他人可能注意不到的事物之美。,0.780,,1,E105,1,2025-12-08 00:00:00.0000000,
1270,6,6,See beauty in things that others might not notice.,我看到他人可能注意不到的事物之美。,0.780,,1,E105,1,2025-12-08 00:00:00.0000000,
1271,6,16,See myself as a good leader.,我認為自己是個好領導者。,0.850,,1,P439,1,2025-12-08 00:00:00.0000000,
1272,6,173,Seek conflict.,我尋求衝突。,0.750,,1,H720,1,2025-12-08 00:00:00.0000000,
1273,6,99,Seldom daydream.,我很少做白日夢。,0.780,,1,X135,1,2025-12-08 00:00:00.0000000,
1274,6,6,Seldom daydream.,我很少做白日夢。,0.780,,1,X135,1,2025-12-08 00:00:00.0000000,
1275,6,156,Seldom feel blue.,我很少感到憂鬱。,0.890,,1,X156,1,2025-12-08 00:00:00.0000000,
1276,6,14,Seldom feel blue.,我很少感到憂鬱。,0.840,,1,X156,1,2025-12-08 00:00:00.0000000,
1277,6,99,Seldom get lost in thought.,我很少陷入沉思。,0.780,,1,X175,1,2025-12-08 00:00:00.0000000,
1278,6,6,Seldom get lost in thought.,我很少陷入沉思。,0.780,,1,X175,1,2025-12-08 00:00:00.0000000,
1279,6,99,Seldom notice the emotional aspects of paintings and pictures.,我很少注意到繪畫和圖片的情感面。,0.780,,1,D4,1,2025-12-08 00:00:00.0000000,
1280,6,6,Seldom notice the emotional aspects of paintings and pictures.,我很少注意到繪畫和圖片的情感面。,0.780,,1,D4,1,2025-12-08 00:00:00.0000000,
1281,6,242,Show my feelings when I'm happy.,當我快樂時我會表現出我的感受。,0.810,,1,A139,1,2025-12-08 00:00:00.0000000,
1282,6,29,Sympathize with others�� feelings.,我同情他人的感受。,0.840,,1,,1,2025-12-08 00:00:00.0000000,
1283,6,173,Take advantage of others.,我占他人便宜。,0.750,,1,"H427, V109",1,2025-12-08 00:00:00.0000000,
1284,6,29,Take an interest in other people��s lives.,我對他人的生活感興趣。,0.840,,1,,1,2025-12-08 00:00:00.0000000,
1285,6,29,Take no time for others.,我不為他人騰出時間。,0.840,,1,"H918, X170",1,2025-12-08 00:00:00.0000000,
1286,6,99,Think quickly.,我思考迅速。,0.840,,1,H1287,1,2025-12-08 00:00:00.0000000,
1287,6,98,Think quickly.,我思考迅速。,0.840,,1,H1287,1,2025-12-08 00:00:00.0000000,
1288,6,163,Want every detail taken care of.,我希望每個細節都得到照顧。,0.800,,1,H1002,1,2025-12-08 00:00:00.0000000,
1289,6,242,Warm up quickly to others.,我很快就能親近他人。,0.810,,1,"H52, X1",1,2025-12-08 00:00:00.0000000,
1290,6,93,Waste my time.,我浪費時間。,0.810,,1,"H1186, X49",1,2025-12-08 00:00:00.0000000,
1291,6,156,Worry about things.,我擔心事情。,0.890,,1,"H1157, X5",1,2025-12-08 00:00:00.0000000,
1292,7,64,Am a very private person.,我是個非常隱私的人。,0.910,,1,H589,1,2025-12-08 00:00:00.0000000,
1293,7,34,Am always prepared.,我總是準備充分。,0.880,,1,X87,1,2025-12-08 00:00:00.0000000,
1294,7,56,Am easily disturbed.,我容易被打擾。,0.910,,1,"H927, X213",1,2025-12-08 00:00:00.0000000,
1295,7,34,Am exacting in my work.,我對工作要求嚴格。,0.880,,1,X163,1,2025-12-08 00:00:00.0000000,
1296,7,98,Am full of ideas.,我充滿想法。,0.900,,1,H53,1,2025-12-08 00:00:00.0000000,
1297,7,98,Am good at many things.,我擅長很多事情。,0.900,,1,H1246,1,2025-12-08 00:00:00.0000000,
1298,7,8,Am hard to get to know.,我很難被了解。,0.880,,1,"H596, X9",1,2025-12-08 00:00:00.0000000,
1299,7,8,Am indifferent to the feelings of others.,我對他人的感受漠不關心。,0.880,,1,X203,1,2025-12-08 00:00:00.0000000,
1300,7,8,Am interested in people.,我對人感興趣。,0.880,,1,H21,1,2025-12-08 00:00:00.0000000,
1301,7,8,Am not really interested in others.,我對他人不太感興趣。,0.880,,1,X165,1,2025-12-08 00:00:00.0000000,
1302,7,8,Am on good terms with nearly everyone.,我與幾乎每個人都相處融洽。,0.880,,1,H37,1,2025-12-08 00:00:00.0000000,
1303,7,64,Am quiet around strangers.,我在陌生人面前很安靜。,0.910,,1,"H661, X260",1,2025-12-08 00:00:00.0000000,
1304,7,64,Am the life of the party.,我是派對的靈魂人物。,0.910,,1,,1,2025-12-08 00:00:00.0000000,
1305,7,64,Bottle up my feelings.,我壓抑自己的感受。,0.910,,1,H1146,1,2025-12-08 00:00:00.0000000,
1306,7,98,Catch on to things quickly.,我能快速領悟事物。,0.900,,1,X275,1,2025-12-08 00:00:00.0000000,
1307,7,56,Change my mood a lot.,我的心情經常變化。,0.910,,1,H926,1,2025-12-08 00:00:00.0000000,
1308,7,34,Continue until everything is perfect.,我會堅持到一切完美為止。,0.880,,1,H286,1,2025-12-08 00:00:00.0000000,
1309,7,98,Do not have a good imagination.,我沒有良好的想像力。,0.900,,1,X272,1,2025-12-08 00:00:00.0000000,
1310,7,64,Don't like to draw attention to myself.,我不喜歡引起注意。,0.910,,1,X68,1,2025-12-08 00:00:00.0000000,
1311,7,64,Don't mind being the center of attention.,我不介意成為注意力的焦點。,0.910,,1,X78,1,2025-12-08 00:00:00.0000000,
1312,7,64,Feel at ease with people.,我與人相處感到自在。,0.910,,1,H1,1,2025-12-08 00:00:00.0000000,
1313,7,64,Feel comfortable around people.,我在人群中感到自在。,0.910,,1,X112,1,2025-12-08 00:00:00.0000000,
1314,7,8,Feel little concern for others.,我很少關心他人。,0.880,,1,X244,1,2025-12-08 00:00:00.0000000,
1315,7,56,Feel threatened easily.,我容易感到威脅。,0.910,,1,H612,1,2025-12-08 00:00:00.0000000,
1316,7,34,Find it difficult to get down to work.,我發現很難開始工作。,0.880,,1,H1171,1,2025-12-08 00:00:00.0000000,
1317,7,34,Follow a schedule.,我遵循時間表。,0.880,,1,X179,1,2025-12-08 00:00:00.0000000,
1318,7,56,Get angry easily.,我容易生氣。,0.910,,1,"H754, X18",1,2025-12-08 00:00:00.0000000,
1319,7,56,Get caught up in my problems.,我陷入自己的問題中。,0.910,,1,X120,1,2025-12-08 00:00:00.0000000,
1320,7,34,Get chores done right away.,我馬上完成家務。,0.880,,1,E119,1,2025-12-08 00:00:00.0000000,
1321,7,56,Get irritated easily.,我容易感到煩躁。,0.910,,1,H761,1,2025-12-08 00:00:00.0000000,
1322,7,56,Get overwhelmed by emotions.,我被情緒淹沒。,0.910,,1,H950,1,2025-12-08 00:00:00.0000000,
1323,7,56,Get upset easily.,我容易沮喪。,0.910,,1,X95,1,2025-12-08 00:00:00.0000000,
1324,7,56,Grumble about things.,我會抱怨事情。,0.910,,1,H1133,1,2025-12-08 00:00:00.0000000,
1325,7,8,Have a good word for everyone.,我對每個人都有好話說。,0.880,,1,H22,1,2025-12-08 00:00:00.0000000,
1326,7,98,Have a vivid imagination.,我有生動的想像力。,0.900,,1,X14,1,2025-12-08 00:00:00.0000000,
1327,7,98,Have difficulty imagining things.,我難以想像事物。,0.900,,1,"H1382, X7",1,2025-12-08 00:00:00.0000000,
1328,7,64,Have little to say.,我沒什麼話可說。,0.910,,1,H1039,1,2025-12-08 00:00:00.0000000,
1329,7,8,Inquire about others' well-being.,我關心他人的健康。,0.880,,1,H225,1,2025-12-08 00:00:00.0000000,
1330,7,64,Know how to captivate people.,我知道如何吸引人。,0.910,,1,H1110,1,2025-12-08 00:00:00.0000000,
