1967,14,128,Seek to influence others.,我尋求影響他人。,0.850,,1,H773,1,2025-12-08 00:00:00.0000000,
1968,14,200,Seldom feel blue.,我很少感到憂鬱。,0.840,,1,X156,1,2025-12-08 00:00:00.0000000,
1969,14,11,Seldom get mad.,我很少生氣。,0.830,,1,X231,1,2025-12-08 00:00:00.0000000,
1970,14,5,Seldom joke around.,我很少開玩笑。,0.710,,1,X137,1,2025-12-08 00:00:00.0000000,
1971,14,11,Seldom take offense.,我很少感到被冒犯。,0.830,,1,X90,1,2025-12-08 00:00:00.0000000,
1972,14,32,Skip difficult words while reading.,我閱讀時會跳過困難的字。,0.800,,1,H1439,1,2025-12-08 00:00:00.0000000,
1973,14,223,Snap at people.,我對人發脾氣。,0.700,,1,H1085,1,2025-12-08 00:00:00.0000000,
1974,14,52,Spend more money than I have.,我花的錢超過我有的。,0.730,,1,E75,1,2025-12-08 00:00:00.0000000,
1975,14,216,Start conversations.,我會開啟對話。,0.870,,1,H16,1,2025-12-08 00:00:00.0000000,
1976,14,169,Stick to my chosen path.,我堅持我選擇的道路。,0.620,,1,H367,1,2025-12-08 00:00:00.0000000,
1977,14,230,Stick to the rules.,我遵守規則。,0.770,,1,H294,1,2025-12-08 00:00:00.0000000,
1978,14,228,Suddenly lose interest.,我突然失去興趣。,0.750,,1,H924,1,2025-12-08 00:00:00.0000000,
1979,14,214,Suffer from others' sorrows.,我為他人的悲傷而受苦。,0.700,,1,"H988, X65",1,2025-12-08 00:00:00.0000000,
1980,14,11,Suspect hidden motives in others.,我懷疑他人有隱藏動機。,0.830,,1,H604,1,2025-12-08 00:00:00.0000000,
1981,14,214,Sympathize with others' feelings.,我同情他人的感受。,0.700,,1,H1130,1,2025-12-08 00:00:00.0000000,
1982,14,231,Sympathize with the homeless.,我同情無家可歸者。,0.690,,1,X259,1,2025-12-08 00:00:00.0000000,
1983,14,128,Take charge.,我會掌控。,0.850,,1,"H334, X27",1,2025-12-08 00:00:00.0000000,
1984,14,82,Take offense easily.,我容易感到被冒犯。,0.800,,1,H920,1,2025-12-08 00:00:00.0000000,
1985,14,188,Take others' interests into account.,我將他人的利益考慮在內。,0.660,,1,H183,1,2025-12-08 00:00:00.0000000,
1986,14,69,Take the initiative.,我採取主動。,0.820,,1,H64,1,2025-12-08 00:00:00.0000000,
1987,14,216,Talk to a lot of different people at parties.,我在派對上和很多不同的人交談。,0.870,,1,X83,1,2025-12-08 00:00:00.0000000,
1988,14,136,Tend to vote for conservative political candidates.,我傾向於投票給保守的政治候選人。,0.850,,1,X126,1,2025-12-08 00:00:00.0000000,
1989,14,136,Tend to vote for liberal political candidates.,我傾向於投票給自由派的政治候選人。,0.850,,1,X218,1,2025-12-08 00:00:00.0000000,
1990,14,200,Think highly of myself.,我對自己評價很高。,0.840,,1,H2043,1,2025-12-08 00:00:00.0000000,
1991,14,208,Think quickly.,我思考迅速。,0.810,,1,H1287,1,2025-12-08 00:00:00.0000000,
1992,14,97,Throw a new light on the situation.,我對情況提出新的見解。,0.780,,1,H472,1,2025-12-08 00:00:00.0000000,
1993,14,231,Treat people as inferiors.,我把人當作下屬對待。,0.690,,1,H792,1,2025-12-08 00:00:00.0000000,
1994,14,223,Trust others.,我信任他人。,0.700,,1,"H113, X6",1,2025-12-08 00:00:00.0000000,
1995,14,188,Try not to think about the needy.,我盡量不去想貧困的人。,0.660,,1,E166,1,2025-12-08 00:00:00.0000000,
1996,14,5,Try out new things.,我嘗試新事物。,0.710,,1,H1269,1,2025-12-08 00:00:00.0000000,
1997,14,188,Try to forgive and forget.,我試圖原諒和忘記。,0.660,,1,E126,1,2025-12-08 00:00:00.0000000,
1998,14,51,Try to outdo others.,我試圖勝過他人。,0.820,,1,H1086,1,2025-12-08 00:00:00.0000000,
1999,14,16,Try to outdo others.,我試圖勝過他人。,0.820,,1,H1086,1,2025-12-08 00:00:00.0000000,
2000,14,51,Try to surpass others' accomplishments.,我試圖超越他人的成就。,0.820,,1,H1193,1,2025-12-08 00:00:00.0000000,
2001,14,16,Try to surpass others' accomplishments.,我試圖超越他人的成就。,0.820,,1,H1193,1,2025-12-08 00:00:00.0000000,
2002,14,31,Understand people who think differently.,我理解那些思考方式不同的人。,0.730,,1,H175,1,2025-12-08 00:00:00.0000000,
2003,14,208,Undertake few things on my own.,我很少主動做事。,0.810,,1,H972,1,2025-12-08 00:00:00.0000000,
2004,14,204,Use flattery to get ahead.,我用奉承來求進步。,0.710,,1,X91,1,2025-12-08 00:00:00.0000000,
2005,14,204,Use swear words.,我使用髒話。,0.710,,1,,1,2025-12-08 00:00:00.0000000,
2006,14,46,Want everything to add up perfectly.,我希望一切都完美相加。,0.800,,1,H241,1,2025-12-08 00:00:00.0000000,
2007,14,46,Want everything to be just right.,我希望一切都恰到好處。,0.800,,1,,1,2025-12-08 00:00:00.0000000,
2008,14,128,Want to be in charge.,我想要掌控。,0.850,,1,H793,1,2025-12-08 00:00:00.0000000,
2009,14,51,Want to control the conversation.,我想要控制對話。,0.820,,1,H770,1,2025-12-08 00:00:00.0000000,
2010,14,16,Want to control the conversation.,我想要控制對話。,0.820,,1,H770,1,2025-12-08 00:00:00.0000000,
2011,14,44,Want to increase my knowledge.,我想要增加我的知識。,0.690,,1,H1213,1,2025-12-08 00:00:00.0000000,
2012,14,206,Waste my time.,我浪費時間。,0.750,,1,"H1186, X49",1,2025-12-08 00:00:00.0000000,
2013,14,97,Would describe my experiences as somewhat dull.,我會把我的經歷描述為有點沉悶。,0.780,,1,X147,1,2025-12-08 00:00:00.0000000,
2014,14,52,Would never cheat on my taxes.,我永遠不會在報稅時作弊。,0.730,,1,X136,1,2025-12-08 00:00:00.0000000,
2015,14,230,Would never go hang gliding or bungee jumping.,我永遠不會去滑翔傘或高空彈跳。,0.770,,1,,1,2025-12-08 00:00:00.0000000,
2016,15,167,Am afraid that I will do the wrong thing.,我擔心自己會做錯事。,0.820,,1,H905,1,2025-12-08 00:00:00.0000000,
2017,15,167,Am filled with doubts about things.,我對事情充滿疑慮。,0.820,,1,H683,1,2025-12-08 00:00:00.0000000,
2018,15,153,Am not bothered by disorder.,我不會被混亂所困擾。,0.810,,1,E7,1,2025-12-08 00:00:00.0000000,
2019,15,153,Am not bothered by messy people.,我不會被凌亂的人困擾。,0.810,,1,E100,1,2025-12-08 00:00:00.0000000,
2020,15,167,Complete tasks successfully.,我成功完成任務。,0.820,,1,H1285,1,2025-12-08 00:00:00.0000000,
2021,15,153,Continue until everything is perfect.,我會堅持到一切完美為止。,0.810,,1,H286,1,2025-12-08 00:00:00.0000000,
2022,15,167,Dislike myself.,我不喜歡自己。,0.820,,1,X15,1,2025-12-08 00:00:00.0000000,
2023,15,167,Excel in nothing at all.,我什麼都不擅長。,0.820,,1,"H1388, X149",1,2025-12-08 00:00:00.0000000,
2024,15,167,Feel comfortable with myself.,我對自己感到自在。,0.820,,1,X129,1,2025-12-08 00:00:00.0000000,
2025,15,153,Follow a schedule.,我遵循時間表。,0.810,,1,X179,1,2025-12-08 00:00:00.0000000,
2026,15,153,Leave a mess in my room.,我把房間弄得一團糟。,0.810,,1,"H822, X16",1,2025-12-08 00:00:00.0000000,
2027,15,153,Leave my belongings around.,我到處亂放東西。,0.810,,1,H823,1,2025-12-08 00:00:00.0000000,
2028,15,153,Like order.,我喜歡秩序。,0.810,,1,X118,1,2025-12-08 00:00:00.0000000,
2029,15,153,Like to tidy up.,我喜歡整理。,0.810,,1,"H244, X21",1,2025-12-08 00:00:00.0000000,
2030,15,167,Mess things up.,我把事情搞砸。,0.820,,1,H896,1,2025-12-08 00:00:00.0000000,
2031,15,167,Question my ability to do my work properly.,我質疑自己正確完成工作的能力。,0.820,,1,X224,1,2025-12-08 00:00:00.0000000,
2032,15,167,Remain calm under pressure.,我在壓力下保持冷靜。,0.820,,1,X79,1,2025-12-08 00:00:00.0000000,
2033,15,167,Seldom feel blue.,我很少感到憂鬱。,0.820,,1,X156,1,2025-12-08 00:00:00.0000000,
2034,15,153,Want everything to add up perfectly.,我希望一切都完美相加。,0.810,,1,H241,1,2025-12-08 00:00:00.0000000,
2035,15,153,Want everything to be just right.,我希望一切都恰到好處。,0.810,,1,,1,2025-12-08 00:00:00.0000000,
2036,16,168,Am considered attractive by others.,我被他人認為有吸引力。,0.870,,1,P425,1,2025-12-08 00:00:00.0000000,
2037,16,168,Attract attention from the opposite sex.,我吸引異性的注意。,0.870,,1,P347,1,2025-12-08 00:00:00.0000000,
2038,16,161,Check on things more often than necessary.,我檢查事情的次數超過必要。,0.870,,1,R79,1,2025-12-08 00:00:00.0000000,
2039,16,168,Dislike looking at my body.,我不喜歡看我的身體。,0.870,,1,P414,1,2025-12-08 00:00:00.0000000,
2040,16,168,Dislike looking at myself in the mirror.,我不喜歡照鏡子看自己。,0.870,,1,P349,1,2025-12-08 00:00:00.0000000,
2041,16,168,Don't consider myself attractive.,我不認為自己有吸引力。,0.870,,1,P471,1,2025-12-08 00:00:00.0000000,
2042,16,161,Feel that I have to repeat certain numbers.,我覺得我必須重複某些數字。,0.870,,1,R34,1,2025-12-08 00:00:00.0000000,
2043,16,161,Feel that there are good and bad numbers.,我覺得有好數字和壞數字。,0.870,,1,R19,1,2025-12-08 00:00:00.0000000,
2044,16,161,Find it difficult to touch an object that has been touched by other,我發現很難觸摸被他人觸摸過的物體。,0.870,,1,,1,2025-12-08 00:00:00.0000000,
2045,16,161,Get upset by unpleasant thoughts that come into my mind.,我被進入腦海的不愉快想法所困擾。,0.870,,1,R37,1,2025-12-08 00:00:00.0000000,
2046,16,161,Get upset if objects are not arranged properly.,如果物體沒有正確排列，我會感到不安。,0.870,,1,R31,1,2025-12-08 00:00:00.0000000,
2047,16,161,Get upset if others change the way that I have arranged things.,如果他人改變我排列的方式，我會感到不安。,0.870,,1,R24,1,2025-12-08 00:00:00.0000000,
2048,16,168,Have a pleasing physique.,我有令人愉悅的體格。,0.870,,1,P358,1,2025-12-08 00:00:00.0000000,
2049,16,161,Have difficulty getting rid of nasty thoughts.,我難以擺脫討厭的想法。,0.870,,1,R45,1,2025-12-08 00:00:00.0000000,
2050,16,168,Like to look at my body.,我喜歡看我的身體。,0.870,,1,P386,1,2025-12-08 00:00:00.0000000,
2051,16,168,Like to look at myself in the mirror.,我喜歡照鏡子看自己。,0.870,,1,P396,1,2025-12-08 00:00:00.0000000,
2052,16,168,Like to show off my body.,我喜歡炫耀我的身體。,0.870,,1,P474,1,2025-12-08 00:00:00.0000000,
2053,16,161,Need things to be arranged in a particular order.,我需要事物以特定順序排列。,0.870,,1,R48,1,2025-12-08 00:00:00.0000000,
2054,16,161,"Repeatedly check doors, windows, and drawers.",我反復檢查門、窗和抽屜。,0.870,,1,R7,1,2025-12-08 00:00:00.0000000,
2055,16,161,Sometimes have to clean myself simply because I feel contaminated.,我有時必須清潔自己只是因為我覺得被污染了。,0.870,,1,R59,1,2025-12-08 00:00:00.0000000,
2056,16,161,Wash my hands more often than is necessary.,我洗手的次數超過必要。,0.870,,1,R47,1,2025-12-08 00:00:00.0000000,
2057,17,48,Drove or rode somewhere without remembering later what happened?during all or part of the trip.,我開車或乘車到某個地方，後來不記得整個或部分旅程中發生的事。,0.900,,1,,1,2025-12-08 00:00:00.0000000,
2058,17,48,Felt as though I was looking at the world through a fog so that?people and objects appeared far away or unclear.,我覺得好像透過迷霧看世界，以至於人們和物體看起來很遙遠或不清楚。,0.900,,1,,1,2025-12-08 00:00:00.0000000,
2059,17,48,Felt like I was disconnected from my body.,我覺得我與我的身體分離了。,0.900,,1,B30,1,2025-12-08 00:00:00.0000000,
2060,17,48,Felt like I was dreaming when I was awake.,我在清醒時覺得自己在做夢。,0.900,,1,B29,1,2025-12-08 00:00:00.0000000,
2061,17,48,Felt that I could not move my hands or feet.,我覺得我無法移動我的手或腳。,0.900,,1,B31,1,2025-12-08 00:00:00.0000000,
2062,17,48,"Find that I sometimes sit staring off into space, thinking of?nothing, and am not aware of the passage of time.",我發現自己有時坐著凝視空間，什麼都不想，並且沒有意識到時間的流逝。,0.900,,1,,1,2025-12-08 00:00:00.0000000,
2063,17,48,Find that in certain situations I am able to do things with?amazing ease and spontaneity that would usually be difficult?for me.,我發現在某些情況下，我能夠以驚人的輕鬆和自發性做通常對我來說很困難的事情。,0.900,,1,,1,2025-12-08 00:00:00.0000000,
2064,17,48,Find that in one situation I act so differently from when I'm in another situation that I feel almost as if I were two different?people.,我發現在一種情況下我的行為與在另一種情況下如此不同，以至於我覺得自己幾乎是兩個不同的人。,0.900,,1,,1,2025-12-08 00:00:00.0000000,
2065,17,48,Found evidence that I had done things that I did not remember?doing.,我發現證據表明我做過我不記得做過的事情。,0.900,,1,,1,2025-12-08 00:00:00.0000000,
2066,17,48,Found myself dressed in clothes I didn't remember putting on.,我發現自己穿著我不記得穿上的衣服。,0.900,,1,B4,1,2025-12-08 00:00:00.0000000,
2067,17,48,Found myself in a place and had no idea how I had gotten there.,我發現自己在一個地方，不知道我是如何到達那裡的。,0.900,,1,B3,1,2025-12-08 00:00:00.0000000,
2068,17,48,Found new things among my belongings that I didn't remember?buying.,我在我的物品中發現了我不記得購買的新東西。,0.900,,1,,1,2025-12-08 00:00:00.0000000,
2069,17,48,Found that I became so involved in a fantasy or daydream that it?felt like it was really happening to me.,我發現我變得如此投入幻想或白日夢，以至於感覺它真的發生在我身上。,0.900,,1,,1,2025-12-08 00:00:00.0000000,
2070,17,48,Found that I could not remember whether I had done something or?had just thought about doing that thing.,我發現我無法記住自己是做了某事還是只是想做那件事。,0.900,,1,,1,2025-12-08 00:00:00.0000000,
2071,17,48,"Found that I had no memory for some important event in my life?(for example, a wedding or graduation).",我發現我對生活中某個重要事件沒有記憶（例如，婚禮或畢業典禮）。,0.900,,1,,1,2025-12-08 00:00:00.0000000,
2072,17,48,Found that I heard voices inside my head that told me to do things?or commented on things that I was doing.,我發現我聽到腦海中的聲音告訴我做事或評論我正在做的事情。,0.900,,1,,1,2025-12-08 00:00:00.0000000,
2073,17,48,Found that I was able to ignore pain.,我發現我能夠忽視疼痛。,0.900,,1,B19,1,2025-12-08 00:00:00.0000000,
2074,17,48,Found that when I was watching television or a movie I became so?absorbed in the story that I was unaware of other events?happening around me.,我發現當我看電視或電影時，我變得如此沉浸在故事中，以至於沒有意識到周圍發生的其他事件。,0.900,,1,,1,2025-12-08 00:00:00.0000000,
2075,17,48,"Found writings, drawings, or notes among my belongings that I must?have done but cannot remember doing.",我在我的物品中發現文字、圖畫或筆記，我一定做過但不記得做過。,0.900,,1,,1,2025-12-08 00:00:00.0000000,
2076,17,48,Had the experience of being accused of lying when I did not think?I had lied.,我有被指控說謊的經歷，而我認為我沒有說謊。,0.900,,1,,1,2025-12-08 00:00:00.0000000,
2077,17,48,Had the experience of being in a familiar place but finding it?strange and unfamiliar.,我有在熟悉的地方但發現它陌生和不熟悉的經歷。,0.900,,1,,1,2025-12-08 00:00:00.0000000,
2078,17,48,"Had the experience of feeling as though I was standing next to?myself, or watching myself as if I was looking at a different?person.",我有感覺自己站在自己旁邊或看著自己好像在看不同人的經歷。,0.900,,1,,1,2025-12-08 00:00:00.0000000,
2079,17,48,Had the experience of feeling that my body did not belong to me.,我有感覺我的身體不屬於我的經歷。,0.900,,1,B13,1,2025-12-08 00:00:00.0000000,
2080,17,48,"Had the experience of feeling that other people, objects, and the?world around me were not real.",我有感覺其他人、物體和周圍的世界不真實的經歷。,0.900,,1,,1,2025-12-08 00:00:00.0000000,
2081,17,48,Had the experience of looking in a mirror and not recognizing?myself.,我有照鏡子但不認識自己的經歷。,0.900,,1,,1,2025-12-08 00:00:00.0000000,
2082,17,48,"Had the experience of not being sure whether things I remember?happening really did happen, or whether I just dreamed them.",我有不確定我記得發生的事情是否真的發生過，還是我只是夢到它們的經歷。,0.900,,1,,1,2025-12-08 00:00:00.0000000,
2083,17,48,Had the experience of remembering a past event so vividly that it?felt like I was reliving that event.,我有如此生動地記住過去事件的經歷，以至於感覺我正在重溫那個事件。,0.900,,1,,1,2025-12-08 00:00:00.0000000,
2084,17,48,Talked out loud to myself.,我大聲自言自語。,0.900,,1,B21,1,2025-12-08 00:00:00.0000000,
2085,17,48,Was approached by someone I didn't know who called me by another?name or who insisted that he or she had met me before.,我被一個我不認識的人接近，他用另一個名字叫我，或者堅持認為他或她以前見過我。,0.900,,1,,1,2025-12-08 00:00:00.0000000,
2086,17,48,Was listening to someone talk and suddenly realized I did not hear?part or all of what was said.,我聽別人說話，突然意識到我沒有聽到部分或全部所說的話。,0.900,,1,,1,2025-12-08 00:00:00.0000000,
2087,17,48,Was told that I sometimes do not recognize a friend or family?member.,我被告知我有時不認識朋友或家人。,0.900,,1,,1,2025-12-08 00:00:00.0000000,
2088,18,72,Accept people as they are.,我接受他人本來的樣子。,0.810,,1,H106,1,2025-12-08 00:00:00.0000000,
2089,18,176,Act impulsively when something is bothering me.,當有事情困擾我時，我會衝動行事。,0.800,,1,Q253,1,2025-12-08 00:00:00.0000000,
2090,18,215,Act like different people in different situations.,我在不同情況下表現得像不同的人。,0.810,,1,P342,1,2025-12-08 00:00:00.0000000,
2091,18,68,Adjust easily.,我容易適應。,0.730,,1,H1070,1,2025-12-08 00:00:00.0000000,
2092,18,59,Admire a really clever scam.,我欣賞真正聰明的騙局。,0.770,,1,A108,1,2025-12-08 00:00:00.0000000,
2093,18,66,Am a physical coward.,我是個身體上的懦夫。,0.840,,1,R44,1,2025-12-08 00:00:00.0000000,
2094,18,68,Am annoyed by others' mistakes.,我會因他人的錯誤而感到煩躁。,0.730,,1,E82,1,2025-12-08 00:00:00.0000000,
2095,18,236,Am considered to be kind of eccentric.,我被認為有點古怪。,0.840,,1,R35,1,2025-12-08 00:00:00.0000000,
2096,18,214,Am deeply moved by others' misfortunes.,我深受他人的不幸所感動。,0.790,,1,X253,1,2025-12-08 00:00:00.0000000,
2097,18,165,Am easily annoyed.,我容易被激怒。,0.880,,1,Q210,1,2025-12-08 00:00:00.0000000,
2098,18,45,Am exacting in my work.,我對工作要求嚴格。,0.810,,1,X163,1,2025-12-08 00:00:00.0000000,
2099,18,39,Am full of ideas.,我充滿想法。,0.850,,1,H53,1,2025-12-08 00:00:00.0000000,
2100,18,217,Am good at making impromptu speeches.,我擅長即興演講。,0.860,,1,P364,1,2025-12-08 00:00:00.0000000,
2101,18,68,Am good at taking advice.,我善於接受建議。,0.730,,1,H1068,1,2025-12-08 00:00:00.0000000,
2102,18,68,Am hard to convince.,我很難被說服。,0.730,,1,H687,1,2025-12-08 00:00:00.0000000,
2103,18,216,Am hard to get to know.,我很難被了解。,0.850,,1,"H596, X9",1,2025-12-08 00:00:00.0000000,
2104,18,68,Am hard to reason with.,我很難被說服。,0.730,,1,H1376,1,2025-12-08 00:00:00.0000000,
2105,18,68,Am hard to satisfy.,我很難被滿足。,0.730,,1,H277,1,2025-12-08 00:00:00.0000000,
2106,18,70,Am inclined to forgive others.,我傾向於原諒他人。,0.780,,1,H137,1,2025-12-08 00:00:00.0000000,
2107,18,96,Am interested in science.,我對科學感興趣。,0.780,,1,Q69,1,2025-12-08 00:00:00.0000000,
2108,18,150,Am just an ordinary person.,我只是個普通人。,0.810,,1,Q103,1,2025-12-08 00:00:00.0000000,
2109,18,150,Am likely to show off if I get the chance.,如果有機會的話我可能會炫耀。,0.810,,1,P441,1,2025-12-08 00:00:00.0000000,
2110,18,76,Am mainly interested in money.,我主要對金錢感興趣。,0.690,,1,Q179,1,2025-12-08 00:00:00.0000000,
2111,18,150,Am more capable than most others.,我比大多數人更有能力。,0.810,,1,P469,1,2025-12-08 00:00:00.0000000,
2112,18,62,Am never at a loss for words.,我從不詞窮。,0.840,,1,H1302,1,2025-12-08 00:00:00.0000000,
2113,18,70,Am nice to people I should be angry at.,我對應該生氣的人也很好。,0.780,,1,Q202,1,2025-12-08 00:00:00.0000000,
2114,18,164,Am not bothered by disorder.,我不會被混亂所困擾。,0.850,,1,E7,1,2025-12-08 00:00:00.0000000,
2115,18,14,Am not easily disturbed by events.,我不容易被事件所困擾。,0.850,,1,"H1046, X11",1,2025-12-08 00:00:00.0000000,
2116,18,76,Am out for my own personal gain.,我是為了自己的個人利益。,0.690,,1,H1325,1,2025-12-08 00:00:00.0000000,
2117,18,72,Am quick to judge others.,我很快就對他人下判斷。,0.810,,1,E65,1,2025-12-08 00:00:00.0000000,
2118,18,214,Am seldom bothered by the apparent suffering of strangers.,我很少被陌生人明顯的痛苦所困擾。,0.790,,1,D93,1,2025-12-08 00:00:00.0000000,
2119,18,214,Am sensitive to the needs of others.,我對他人的需求很敏感。,0.790,,1,Q256,1,2025-12-08 00:00:00.0000000,
2120,18,62,Am the life of the party.,我是派對的靈魂人物。,0.840,,1,,1,2025-12-08 00:00:00.0000000,
2121,18,165,Am usually a patient person.,我通常是個有耐心的人。,0.880,,1,D63,1,2025-12-08 00:00:00.0000000,
2122,18,137,Am usually active and full of energy.,我通常很活躍並充滿活力。,0.820,,1,C4,1,2025-12-08 00:00:00.0000000,
2123,18,66,Am willing to take risks.,我願意冒險。,0.840,,1,Q95,1,2025-12-08 00:00:00.0000000,
2124,18,96,Avoid difficult reading material.,我避免閱讀困難的材料。,0.780,,1,X109,1,2025-12-08 00:00:00.0000000,
2125,18,176,Avoid mistakes.,我避免錯誤。,0.800,,1,H252,1,2025-12-08 00:00:00.0000000,
2126,18,72,Become frustrated and angry with people when they don't live up to my expectations.,當人們沒有達到我的期望時，我會感到沮喪和憤怒。,0.810,,1,D100,1,2025-12-08 00:00:00.0000000,
2127,18,66,Begin to panic when there is danger.,當有危險時我開始驚慌。,0.840,,1,Q50,1,2025-12-08 00:00:00.0000000,
2128,18,150,Believe that I am better than others.,我相信自己比他人優越。,0.810,,1,"H736, X61",1,2025-12-08 00:00:00.0000000,
2129,18,150,Boast about my virtues.,我吹噓自己的美德。,0.810,,1,H746,1,2025-12-08 00:00:00.0000000,
2130,18,62,Bottle up my feelings.,我壓抑自己的感受。,0.840,,1,H1146,1,2025-12-08 00:00:00.0000000,
2131,18,33,Can't do without the company of others.,我離不開他人的陪伴。,0.730,,1,H965,1,2025-12-08 00:00:00.0000000,
2132,18,68,Can't stand being contradicted.,我無法忍受被反駁。,0.730,,1,H292,1,2025-12-08 00:00:00.0000000,
2133,18,39,Carry the conversation to a higher level.,我能將對話提升到更高層次。,0.850,,1,H1227,1,2025-12-08 00:00:00.0000000,
2134,18,59,Cheat on people who have trusted me.,我欺騙信任我的人。,0.770,,1,Q22,1,2025-12-08 00:00:00.0000000,
2135,18,59,Cheat to get ahead.,我作弊以求進步。,0.770,,1,X198,1,2025-12-08 00:00:00.0000000,
2136,18,39,Come up with something new.,我想出新的東西。,0.850,,1,H1230,1,2025-12-08 00:00:00.0000000,
2137,18,45,Complete tasks successfully.,我成功完成任務。,0.810,,1,H1285,1,2025-12-08 00:00:00.0000000,
2138,18,150,Consider myself an average person.,我認為自己是個普通人。,0.810,,1,X125,1,2025-12-08 00:00:00.0000000,
2139,18,72,Criticize others' shortcomings.,我批評他人的缺點。,0.810,,1,H279,1,2025-12-08 00:00:00.0000000,
2140,18,167,Demand quality.,我要求品質。,0.800,,1,H288,1,2025-12-08 00:00:00.0000000,
2141,18,167,Detect mistakes.,我能發現錯誤。,0.800,,1,H1293,1,2025-12-08 00:00:00.0000000,
2142,18,167,Dislike imperfect work.,我不喜歡不完美的工作。,0.800,,1,H271,1,2025-12-08 00:00:00.0000000,
2143,18,70,Distrust people.,我不信任人們。,0.780,,1,"H1195, X12",1,2025-12-08 00:00:00.0000000,
2144,18,45,Do just enough work to get by.,我只做足夠的工作。,0.810,,1,X115,1,2025-12-08 00:00:00.0000000,
2145,18,6,Do not enjoy watching dance performances.,我不喜歡觀看舞蹈表演。,0.830,,1,X243,1,2025-12-08 00:00:00.0000000,
2146,18,39,Do not have a good imagination.,我沒有良好的想像力。,0.850,,1,X272,1,2025-12-08 00:00:00.0000000,
2147,18,6,Do not like art.,我不喜歡藝術。,0.830,,1,X86,1,2025-12-08 00:00:00.0000000,
2148,18,6,Do not like concerts.,我不喜歡音樂會。,0.830,,1,X144,1,2025-12-08 00:00:00.0000000,
2149,18,176,Do things according to a plan.,我按計劃做事。,0.800,,1,H1351,1,2025-12-08 00:00:00.0000000,
2150,18,236,Do things that others find strange.,我做他人覺得奇怪的事。,0.840,,1,H691,1,2025-12-08 00:00:00.0000000,
2151,18,176,Do things without thinking of the consequences.,我做事不考慮後果。,0.800,,1,Q243,1,2025-12-08 00:00:00.0000000,
2152,18,45,Do too little work.,我做的工作太少。,0.810,,1,P385,1,2025-12-08 00:00:00.0000000,
2153,18,96,Don't bother worrying about political and social problems.,我不為政治和社會問題煩惱。,0.780,,1,Q222,1,2025-12-08 00:00:00.0000000,
2154,18,164,Don't finish the things that I start.,我不完成我開始的事。,0.850,,1,R12,1,2025-12-08 00:00:00.0000000,
2155,18,96,Don't know much about history.,我對歷史了解不多。,0.780,,1,Q82,1,2025-12-08 00:00:00.0000000,
2156,18,176,Don't know why I do some of the things I do.,我不知道為什麼我做某些事。,0.800,,1,E57,1,2025-12-08 00:00:00.0000000,
2157,18,62,Don't like to draw attention to myself.,我不喜歡引起注意。,0.840,,1,X68,1,2025-12-08 00:00:00.0000000,
