instrument,alpha,alpha2,key,text_en,text_zh,label,label_zh,IPIP_item_number
BFAS,0.75,,-1,Believe that I am better than others.,我相信自己比他人優越。,Positive Expressivity,正向表達性,"H736, X61"
BFAS,0.89,,1,Can be stirred up easily.,我容易被激動。,Neuroticism,神經質,H921
BFAS,0.89,,1,Can be stirred up easily.,我容易被激動。,Anger,憤怒,H921
BFAS,0.84,,1,Can handle a lot of information.,我能處理大量資訊。,Intellectual Openness,智識開放性,H1322
BFAS,0.84,,1,Can handle a lot of information.,我能處理大量資訊。,Intellect,智力,H1322
BFAS,0.85,,1,Can talk others into doing things.,我能說服他人做事。,Assertiveness,自信堅定,H1137
BFAS,0.84,,-1,Can��t be bothered with other��s needs.,我不關心他人的需求。,Compassion,同情心,
BFAS,0.81,,1,Carry out my plans.,我執行我的計劃。,Industriousness/Perseverance/Persistence,勤勉/堅持/毅力,H258
BFAS,0.89,,1,Change my mood a lot.,我的心情經常變化。,Neuroticism,神經質,H926
BFAS,0.89,,1,Change my mood a lot.,我的心情經常變化。,Anger,憤怒,H926
BFAS,0.85,,-1,Do not have an assertive personality.,我沒有自信堅定的個性。,Assertiveness,自信堅定,
BFAS,0.78,,-1,Do not like poetry.,我不喜歡詩歌。,Intellectual Openness,智識開放性,X45
BFAS,0.78,,-1,Do not like poetry.,我不喜歡詩歌。,Aesthetic Appreciation/Artistic Interests,美學欣賞/藝術興趣,X45
BFAS,0.84,,-1,Don��t have a soft side.,我沒有柔軟的一面。,Compassion,同情心,
BFAS,0.81,,-1,Don��t put my mind on the task at hand.,我不把注意力放在手頭的任務上。,Industriousness/Perseverance/Persistence,勤勉/堅持/毅力,
BFAS,0.78,,1,Enjoy the beauty of nature.,我喜歡大自然的美。,Intellectual Openness,智識開放性,"W15, X261"
BFAS,0.78,,1,Enjoy the beauty of nature.,我喜歡大自然的美。,Aesthetic Appreciation/Artistic Interests,美學欣賞/藝術興趣,"W15, X261"
BFAS,0.89,,-1,Feel comfortable with myself.,我對自己感到自在。,Neuroticism,神經質,X129
BFAS,0.84,,-1,Feel comfortable with myself.,我對自己感到自在。,Anxiety,焦慮,X129
BFAS,0.84,,1,Feel others�� emotions.,我能感受他人的情緒。,Compassion,同情心,
BFAS,0.89,,1,Feel threatened easily.,我容易感到威脅。,Neuroticism,神經質,H612
BFAS,0.81,,-1,Find it difficult to get down to work.,我發現很難開始工作。,Industriousness/Perseverance/Persistence,勤勉/堅持/毅力,H1171
BFAS,0.81,,1,Finish what I start.,我完成我開始的事。,Industriousness/Perseverance/Persistence,勤勉/堅持/毅力,H254
BFAS,0.84,,1,Formulate ideas clearly.,我清晰地表達想法。,Intellectual Openness,智識開放性,H1219
BFAS,0.84,,1,Formulate ideas clearly.,我清晰地表達想法。,Intellect,智力,H1219
BFAS,0.89,,1,Get angry easily.,我容易生氣。,Neuroticism,神經質,"H754, X18"
BFAS,0.89,,1,Get angry easily.,我容易生氣。,Anger,憤怒,"H754, X18"
BFAS,0.78,,1,Get deeply immersed in music.,我深深沉浸於音樂中。,Intellectual Openness,智識開放性,Q51
BFAS,0.78,,1,Get deeply immersed in music.,我深深沉浸於音樂中。,Aesthetic Appreciation/Artistic Interests,美學欣賞/藝術興趣,Q51
BFAS,0.89,,1,Get easily agitated.,我容易激動。,Neuroticism,神經質,Q77
BFAS,0.89,,1,Get easily agitated.,我容易激動。,Anger,憤怒,Q77
BFAS,0.81,,1,Get things done quickly.,我快速完成事情。,Industriousness/Perseverance/Persistence,勤勉/堅持/毅力,H555
BFAS,0.89,,1,Get upset easily.,我容易沮喪。,Neuroticism,神經質,X95
BFAS,0.89,,1,Get upset easily.,我容易沮喪。,Anger,憤怒,X95
BFAS,0.75,,1,Hate to seem pushy.,我討厭看起來咄咄逼人。,Positive Expressivity,正向表達性,E31
BFAS,0.81,,1,Have a lot of fun.,我玩得很開心。,Vitality/Enthusiasm/Zest,活力/熱情/熱忱,H1094
BFAS,0.84,,1,Have a rich vocabulary.,我的詞彙量很豐富。,Intellectual Openness,智識開放性,"H1276, X245"
BFAS,0.85,,1,Have a strong personality.,我有強烈的個性。,Assertiveness,自信堅定,Q14
BFAS,0.84,,-1,Have difficulty understanding abstract ideas.,我難以理解抽象概念。,Intellectual Openness,智識開放性,X176
BFAS,0.85,,-1,Hold back my opinions.,我保留自己的意見。,Assertiveness,自信堅定,H679
BFAS,0.84,,1,Inquire about others' well-being.,我關心他人的健康。,Compassion,同情心,H225
BFAS,0.75,,-1,Insult people.,我侮辱他人。,Positive Expressivity,正向表達性,H1103
BFAS,0.89,,-1,Keep my emotions under control.,我控制自己的情緒。,Neuroticism,神經質,H381
BFAS,0.89,,-1,Keep my emotions under control.,我控制自己的情緒。,Anger,憤怒,H381
BFAS,0.81,,-1,Keep others at a distance.,我與他人保持距離。,Vitality/Enthusiasm/Zest,活力/熱情/熱忱,H704
BFAS,0.8,,1,Keep things tidy.,我保持東西整潔。,Orderliness,條理性,Q104
BFAS,0.85,,1,Know how to captivate people.,我知道如何吸引人。,Assertiveness,自信堅定,H1110
BFAS,0.85,,-1,Lack the talent for influencing people.,我缺乏影響他人的才能。,Assertiveness,自信堅定,P346
BFAS,0.81,,1,Laugh a lot.,我經常笑。,Vitality/Enthusiasm/Zest,活力/熱情/熱忱,Q138
BFAS,0.84,,-1,Learn things slowly.,我學得很慢。,Intellectual Openness,智識開放性,Q67
BFAS,0.84,,-1,Learn things slowly.,我學得很慢。,Intellect,智力,Q67
BFAS,0.84,,1,Like to do things for others.,我喜歡為他人做事。,Compassion,同情心,H109
BFAS,0.84,,1,Like to solve complex problems.,我喜歡解決複雜的問題。,Intellectual Openness,智識開放性,X201
BFAS,0.84,,1,Like to solve complex problems.,我喜歡解決複雜的問題。,Intellect,智力,X201
BFAS,0.75,,-1,Love a good fight.,我喜歡好的戰鬥。,Positive Expressivity,正向表達性,H453
BFAS,0.78,,1,Love to reflect on things.,我喜愛反思事物。,Intellectual Openness,智識開放性,H1210
BFAS,0.78,,1,Love to reflect on things.,我喜愛反思事物。,Aesthetic Appreciation/Artistic Interests,美學欣賞/藝術興趣,H1210
BFAS,0.81,,1,Make friends easily.,我很容易交朋友。,Vitality/Enthusiasm/Zest,活力/熱情/熱忱,H29
BFAS,0.81,,-1,Mess things up.,我把事情搞砸。,Industriousness/Perseverance/Persistence,勤勉/堅持/毅力,H896
BFAS,0.78,,1,Need a creative outlet.,我需要創意出口。,Intellectual Openness,智識開放性,E87
BFAS,0.78,,1,Need a creative outlet.,我需要創意出口。,Aesthetic Appreciation/Artistic Interests,美學欣賞/藝術興趣,E87
BFAS,0.81,,-1,Postpone decisions.,我推遲決定。,Industriousness/Perseverance/Persistence,勤勉/堅持/毅力,H1180
BFAS,0.89,,-1,Rarely feel depressed.,我很少感到沮喪。,Neuroticism,神經質,D87
BFAS,0.84,,-1,Rarely feel depressed.,我很少感到沮喪。,Anxiety,焦慮,D87
BFAS,0.81,,-1,Rarely get caught up in the excitement.,我很少被興奮感染。,Vitality/Enthusiasm/Zest,活力/熱情/熱忱,A13
BFAS,0.89,,-1,Rarely get irritated.,我很少感到煩躁。,Neuroticism,神經質,X265
BFAS,0.89,,-1,Rarely get irritated.,我很少感到煩躁。,Anger,憤怒,X265
BFAS,0.89,,-1,Rarely lose my composure.,我很少失去鎮定。,Neuroticism,神經質,E99
BFAS,0.89,,-1,Rarely lose my composure.,我很少失去鎮定。,Anger,憤怒,E99
BFAS,0.75,,1,Rarely put people under pressure.,我很少給人施加壓力。,Positive Expressivity,正向表達性,
BFAS,0.75,,1,Respect authority.,我尊重權威。,Positive Expressivity,正向表達性,H296
BFAS,0.81,,-1,Reveal little about myself.,我很少透露自己的事。,Vitality/Enthusiasm/Zest,活力/熱情/熱忱,H601
BFAS,0.78,,1,See beauty in things that others might not notice.,我看到他人可能注意不到的事物之美。,Intellectual Openness,智識開放性,E105
BFAS,0.78,,1,See beauty in things that others might not notice.,我看到他人可能注意不到的事物之美。,Aesthetic Appreciation/Artistic Interests,美學欣賞/藝術興趣,E105
BFAS,0.85,,1,See myself as a good leader.,我認為自己是個好領導者。,Assertiveness,自信堅定,P439
BFAS,0.75,,-1,Seek conflict.,我尋求衝突。,Positive Expressivity,正向表達性,H720
BFAS,0.78,,-1,Seldom daydream.,我很少做白日夢。,Intellectual Openness,智識開放性,X135
BFAS,0.78,,-1,Seldom daydream.,我很少做白日夢。,Aesthetic Appreciation/Artistic Interests,美學欣賞/藝術興趣,X135
BFAS,0.89,,-1,Seldom feel blue.,我很少感到憂鬱。,Neuroticism,神經質,X156
BFAS,0.84,,-1,Seldom feel blue.,我很少感到憂鬱。,Anxiety,焦慮,X156
BFAS,0.78,,-1,Seldom get lost in thought.,我很少陷入沉思。,Intellectual Openness,智識開放性,X175
BFAS,0.78,,-1,Seldom get lost in thought.,我很少陷入沉思。,Aesthetic Appreciation/Artistic Interests,美學欣賞/藝術興趣,X175
BFAS,0.78,,-1,Seldom notice the emotional aspects of paintings and pictures.,我很少注意到繪畫和圖片的情感面。,Intellectual Openness,智識開放性,D4
BFAS,0.78,,-1,Seldom notice the emotional aspects of paintings and pictures.,我很少注意到繪畫和圖片的情感面。,Aesthetic Appreciation/Artistic Interests,美學欣賞/藝術興趣,D4
BFAS,0.81,,1,Show my feelings when I'm happy.,當我快樂時我會表現出我的感受。,Vitality/Enthusiasm/Zest,活力/熱情/熱忱,A139
BFAS,0.84,,1,Sympathize with others�� feelings.,我同情他人的感受。,Compassion,同情心,
BFAS,0.75,,-1,Take advantage of others.,我占他人便宜。,Positive Expressivity,正向表達性,"H427, V109"
BFAS,0.84,,1,Take an interest in other people��s lives.,我對他人的生活感興趣。,Compassion,同情心,
BFAS,0.84,,-1,Take no time for others.,我不為他人騰出時間。,Compassion,同情心,"H918, X170"
BFAS,0.84,,1,Think quickly.,我思考迅速。,Intellectual Openness,智識開放性,H1287
BFAS,0.84,,1,Think quickly.,我思考迅速。,Intellect,智力,H1287
BFAS,0.8,,1,Want every detail taken care of.,我希望每個細節都得到照顧。,Orderliness,條理性,H1002
BFAS,0.81,,1,Warm up quickly to others.,我很快就能親近他人。,Vitality/Enthusiasm/Zest,活力/熱情/熱忱,"H52, X1"
BFAS,0.81,,-1,Waste my time.,我浪費時間。,Industriousness/Perseverance/Persistence,勤勉/堅持/毅力,"H1186, X49"
BFAS,0.89,,1,Worry about things.,我擔心事情。,Neuroticism,神經質,"H1157, X5"
BFAS-20,0.91,,-1,Am a very private person.,我是個非常隱私的人。,Extraversion,外向性,H589
BFAS-20,0.88,,1,Am always prepared.,我總是準備充分。,Conscientiousness,盡責性,X87
BFAS-20,0.91,,-1,Am easily disturbed.,我容易被打擾。,Emotional Stability,情緒穩定性,"H927, X213"
BFAS-20,0.88,,1,Am exacting in my work.,我對工作要求嚴格。,Conscientiousness,盡責性,X163
BFAS-20,0.9,,1,Am full of ideas.,我充滿想法。,Intellect,智力,H53
BFAS-20,0.9,,1,Am good at many things.,我擅長很多事情。,Intellect,智力,H1246
BFAS-20,0.88,,-1,Am hard to get to know.,我很難被了解。,Agreeableness,親和性,"H596, X9"
BFAS-20,0.88,,-1,Am indifferent to the feelings of others.,我對他人的感受漠不關心。,Agreeableness,親和性,X203
BFAS-20,0.88,,1,Am interested in people.,我對人感興趣。,Agreeableness,親和性,H21
BFAS-20,0.88,,-1,Am not really interested in others.,我對他人不太感興趣。,Agreeableness,親和性,X165
BFAS-20,0.88,,1,Am on good terms with nearly everyone.,我與幾乎每個人都相處融洽。,Agreeableness,親和性,H37
BFAS-20,0.91,,-1,Am quiet around strangers.,我在陌生人面前很安靜。,Extraversion,外向性,"H661, X260"
BFAS-20,0.91,,1,Am the life of the party.,我是派對的靈魂人物。,Extraversion,外向性,
BFAS-20,0.91,,-1,Bottle up my feelings.,我壓抑自己的感受。,Extraversion,外向性,H1146
BFAS-20,0.9,,1,Catch on to things quickly.,我能快速領悟事物。,Intellect,智力,X275
BFAS-20,0.91,,-1,Change my mood a lot.,我的心情經常變化。,Emotional Stability,情緒穩定性,H926
BFAS-20,0.88,,1,Continue until everything is perfect.,我會堅持到一切完美為止。,Conscientiousness,盡責性,H286
BFAS-20,0.9,,-1,Do not have a good imagination.,我沒有良好的想像力。,Intellect,智力,X272
BFAS-20,0.91,,-1,Don't like to draw attention to myself.,我不喜歡引起注意。,Extraversion,外向性,X68
BFAS-20,0.91,,1,Don't mind being the center of attention.,我不介意成為注意力的焦點。,Extraversion,外向性,X78
BFAS-20,0.91,,1,Feel at ease with people.,我與人相處感到自在。,Extraversion,外向性,H1
BFAS-20,0.91,,1,Feel comfortable around people.,我在人群中感到自在。,Extraversion,外向性,X112
BFAS-20,0.88,,-1,Feel little concern for others.,我很少關心他人。,Agreeableness,親和性,X244
BFAS-20,0.91,,-1,Feel threatened easily.,我容易感到威脅。,Emotional Stability,情緒穩定性,H612
BFAS-20,0.88,,-1,Find it difficult to get down to work.,我發現很難開始工作。,Conscientiousness,盡責性,H1171
BFAS-20,0.88,,1,Follow a schedule.,我遵循時間表。,Conscientiousness,盡責性,X179
BFAS-20,0.91,,-1,Get angry easily.,我容易生氣。,Emotional Stability,情緒穩定性,"H754, X18"
BFAS-20,0.91,,-1,Get caught up in my problems.,我陷入自己的問題中。,Emotional Stability,情緒穩定性,X120
BFAS-20,0.88,,1,Get chores done right away.,我馬上完成家務。,Conscientiousness,盡責性,E119
BFAS-20,0.91,,-1,Get irritated easily.,我容易感到煩躁。,Emotional Stability,情緒穩定性,H761
BFAS-20,0.91,,-1,Get overwhelmed by emotions.,我被情緒淹沒。,Emotional Stability,情緒穩定性,H950
BFAS-20,0.91,,-1,Get upset easily.,我容易沮喪。,Emotional Stability,情緒穩定性,X95
BFAS-20,0.91,,-1,Grumble about things.,我會抱怨事情。,Emotional Stability,情緒穩定性,H1133
BFAS-20,0.88,,1,Have a good word for everyone.,我對每個人都有好話說。,Agreeableness,親和性,H22
BFAS-20,0.9,,1,Have a vivid imagination.,我有生動的想像力。,Intellect,智力,X14
BFAS-20,0.9,,-1,Have difficulty imagining things.,我難以想像事物。,Intellect,智力,"H1382, X7"
BFAS-20,0.91,,-1,Have little to say.,我沒什麼話可說。,Extraversion,外向性,H1039
BFAS-20,0.88,,1,Inquire about others' well-being.,我關心他人的健康。,Agreeableness,親和性,H225
BFAS-20,0.91,,1,Know how to captivate people.,我知道如何吸引人。,Extraversion,外向性,H1110
BFAS-20,0.88,,1,Know how to comfort others.,我知道如何安慰他人。,Agreeableness,親和性,H173
BFAS-20,0.88,,-1,Leave a mess in my room.,我把房間弄得一團糟。,Conscientiousness,盡責性,"H822, X16"
BFAS-20,0.88,,-1,Leave my belongings around.,我到處亂放東西。,Conscientiousness,盡責性,H823
BFAS-20,0.88,,1,Like to tidy up.,我喜歡整理。,Conscientiousness,盡責性,"H244, X21"
BFAS-20,0.88,,1,Love children.,我喜愛孩子。,Agreeableness,親和性,X73
BFAS-20,0.88,,1,Love order and regularity.,我喜愛秩序和規律。,Conscientiousness,盡責性,H309
BFAS-20,0.88,,1,Love to help others.,我喜愛幫助他人。,Agreeableness,親和性,H1108
BFAS-20,0.9,,1,Love to read challenging material.,我喜愛閱讀有挑戰性的材料。,Intellect,智力,X211
BFAS-20,0.9,,1,Love to think up new ways of doing things.,我喜愛想出新的做事方法。,Intellect,智力,X225
BFAS-20,0.88,,-1,Make a mess of things.,我把事情搞砸。,Conscientiousness,盡責性,H1467
BFAS-20,0.88,,1,Make plans and stick to them.,我制定計劃並堅持執行。,Conscientiousness,盡責性,X263
BFAS-20,0.91,,-1,Often feel uncomfortable around others.,我經常在他人身邊感到不自在。,Extraversion,外向性,H909
BFAS-20,0.91,,-1,Panic easily.,我容易驚慌。,Emotional Stability,情緒穩定性,"H948, X64"
BFAS-20,0.91,,1,Rarely get irritated.,我很少感到煩躁。,Emotional Stability,情緒穩定性,X265
BFAS-20,0.91,,1,Seldom get mad.,我很少生氣。,Emotional Stability,情緒穩定性,X231
BFAS-20,0.88,,-1,Shirk my duties.,我逃避我的職責。,Conscientiousness,盡責性,"H1140, X246"
BFAS-20,0.88,,1,Show my gratitude.,我表現出我的感激。,Agreeableness,親和性,H557
BFAS-20,0.9,,1,Spend time reflecting on things.,我花時間反思事物。,Intellect,智力,X114
BFAS-20,0.91,,1,Start conversations.,我會開啟對話。,Extraversion,外向性,H16
BFAS-20,0.91,,-1,Take offense easily.,我容易感到被冒犯。,Emotional Stability,情緒穩定性,H920
BFAS-20,0.88,,1,Take time out for others.,我會為他人騰出時間。,Agreeableness,親和性,H160
BFAS-20,0.88,,1,Think of others first.,我首先考慮他人。,Agreeableness,親和性,H126
BFAS-20,0.91,,-1,Wait for others to lead the way.,我等待他人帶路。,Extraversion,外向性,H976
BFAS-20,0.88,,-1,Waste my time.,我浪費時間。,Conscientiousness,盡責性,"H1186, X49"
BFAS-20,0.91,,-1,Worry about things.,我擔心事情。,Emotional Stability,情緒穩定性,"H1157, X5"
BIDR,0.87,,1,Always admit it when I make a mistake.,當我犯錯時我總是承認。,Impression-Management,印象管理,P454
BIDR,0.8,,1,Always know why I do things.,我總是知道我為什麼做事情。,Self-deception,自欺,P433
BIDR,0.79,,-1,Always know why I do things.,我總是知道我為什麼做事情。,Cognitive-Failures,認知失誤,P433
BIDR,0.87,,-1,Am likely to show off if I get the chance.,如果有機會的話我可能會炫耀。,Impression-Management,印象管理,P441
BIDR,0.8,,-1,Am not always honest with myself.,我對自己並不總是誠實。,Self-deception,自欺,P490
BIDR,0.87,,-1,Am not always what I appear to be.,我並不總是我看起來的樣子。,Impression-Management,印象管理,
BIDR,0.87,,1,Believe there is never an excuse for lying.,我相信說謊永遠沒有藉口。,Impression-Management,印象管理,
BIDR,0.87,,-1,Break rules.,我違反規則。,Impression-Management,印象管理,H1346
BIDR,0.79,,1,Can't make up my mind.,我無法下定決心。,Cognitive-Failures,認知失誤,H901
BIDR,0.87,,-1,Cheat to get ahead.,我作弊以求進步。,Impression-Management,印象管理,X198
BIDR,0.8,,-1,Dislike myself.,我不喜歡自己。,Self-deception,自欺,X15
BIDR,0.87,,-1,Don't always practice what I preach.,我並不總是言行一致。,Impression-Management,印象管理,P481
BIDR,0.87,,1,Easily resist temptations.,我容易抵抗誘惑。,Impression-Management,印象管理,X274
BIDR,0.8,,1,Feel comfortable with myself.,我對自己感到自在。,Self-deception,自欺,X129
BIDR,0.87,,-1,Get back at others.,我會報復他人。,Impression-Management,印象管理,H699
BIDR,0.79,,1,Get confused easily.,我容易感到困惑。,Cognitive-Failures,認知失誤,H855
BIDR,0.8,,-1,Have a low opinion of myself.,我對自己評價很低。,Self-deception,自欺,"H646, X152"
BIDR,0.79,,1,Have difficulty keeping things in mind.,我很難把事情記在心裡。,Cognitive-Failures,認知失誤,H1435
BIDR,0.87,,-1,Have sometimes had to tell a lie.,我有時不得不說謊。,Impression-Management,印象管理,P356
BIDR,0.8,,1,Just know that I will be a success.,我知道我會成功。,Self-deception,自欺,P379
BIDR,0.8,,1,Know that my decisions are correct.,我知道我的決定是正確的。,Self-deception,自欺,H324
BIDR,0.79,,1,Let my attention wander off.,我讓注意力遊移。,Cognitive-Failures,認知失誤,H931
BIDR,0.8,,1,Like to take responsibility for making decisions.,我喜歡承擔做決定的責任。,Self-deception,自欺,P473
BIDR,0.79,,-1,Like to take responsibility for making decisions.,我喜歡承擔做決定的責任。,Cognitive-Failures,認知失誤,P473
BIDR,0.87,,-1,Misuse power.,我濫用權力。,Impression-Management,印象管理,H785
BIDR,0.79,,1,Often forget things.,我經常忘記事情。,Cognitive-Failures,認知失誤,X141
BIDR,0.79,,-1,Pay attention to details.,我注意細節。,Cognitive-Failures,認知失誤,"H1362, X249"
BIDR,0.87,,1,Rarely overindulge.,我很少過度放縱。,Impression-Management,印象管理,X181
BIDR,0.87,,1,Rarely talk about sex.,我很少談論性。,Impression-Management,印象管理,P418
BIDR,0.79,,-1,Remain calm under pressure.,我在壓力下保持冷靜。,Cognitive-Failures,認知失誤,X79
BIDR,0.87,,1,Return extra change when a cashier makes a mistake.,當收銀員犯錯時，我會退回多餘的零錢。,Impression-Management,印象管理,E80
BIDR,0.8,,-1,Sometimes have trouble making up my mind.,我有時在下定決心時有困難。,Self-deception,自欺,P390
BIDR,0.79,,1,Spill things.,我會打翻東西。,Cognitive-Failures,認知失誤,H1409
BIDR,0.87,,1,Tell the truth.,我說實話。,Impression-Management,印象管理,H145
BIDR,0.87,,1,Try to follow the rules.,我試圖遵守規則。,Impression-Management,印象管理,X150
BIDR,0.87,,-1,Use flattery to get ahead.,我用奉承來求進步。,Impression-Management,印象管理,X91
BIDR,0.87,,-1,Use swear words.,我使用髒話。,Impression-Management,印象管理,
BIDR,0.8,,-1,Worry about what people think of me.,我擔心人們對我的看法。,Self-deception,自欺,P420
BIDR,0.87,,1,Would never cheat on my taxes.,我永遠不會在報稅時作弊。,Impression-Management,印象管理,X136
BIDR,0.87,,1,Would never take things that aren't mine.,我永遠不會拿不屬於我的東西。,Impression-Management,印象管理,P367
BIS_BAS,,,1,Am afraid that I will do the wrong thing.,我擔心自己會做錯事。,Behavioral Inhibition/Activation System,行為抑制/激活系統,H905
BIS_BAS,,,1,Am always worried about something.,我總是擔心某事。,Behavioral Inhibition/Activation System,行為抑制/激活系統,D96
BIS_BAS,,,1,Am always worried about something.,我總是擔心某事。,Anxiety,焦慮,D96
BIS_BAS,0.68,,1,Am eager to soothe hurt feelings.,我渴望撫慰受傷的感受。,Excitement-seeking,尋求刺激,Q117
BIS_BAS,,,1,Am easily hurt.,我容易受傷。,Behavioral Inhibition/Activation System,行為抑制/激活系統,H987
BIS_BAS,0.77,,-1,Am not an extraordinary person.,我不是個非凡的人。,Ambition/Drive,野心/動力,P462
BIS_BAS,,,-1,Am not embarrassed easily.,我不容易感到尷尬。,Behavioral Inhibition/Activation System,行為抑制/激活系統,X242
BIS_BAS,0.77,,-1,Am not highly motivated to succeed.,我沒有強烈的成功動機。,Ambition/Drive,野心/動力,X110
BIS_BAS,0.79,,1,Am willing to try anything once.,我願意嘗試任何事。,Risk-taking/Sensation-Seeking/Thrill-Seeking,冒險/尋求感覺/尋求刺激,X3
BIS_BAS,0.79,,-1,Avoid dangerous situations.,我避免危險情況。,Risk-taking/Sensation-Seeking/Thrill-Seeking,冒險/尋求感覺/尋求刺激,H317
BIS_BAS,,,1,Become overwhelmed by events.,我被事件壓倒。,Behavioral Inhibition/Activation System,行為抑制/激活系統,H959
BIS_BAS,,,1,Begin to panic when there is danger.,當有危險時我開始驚慌。,Behavioral Inhibition/Activation System,行為抑制/激活系統,Q50
BIS_BAS,,,1,Begin to panic when there is danger.,當有危險時我開始驚慌。,Anxiety,焦慮,Q50
BIS_BAS,0.79,,1,Do crazy things.,我做瘋狂的事情。,Risk-taking/Sensation-Seeking/Thrill-Seeking,冒險/尋求感覺/尋求刺激,H870
BIS_BAS,0.68,,-1,Don't get excited about things.,我對事物不感到興奮。,Excitement-seeking,尋求刺激,H572
BIS_BAS,0.79,,1,Enjoy being reckless.,我喜歡冒險行事。,Risk-taking/Sensation-Seeking/Thrill-Seeking,冒險/尋求感覺/尋求刺激,E35
BIS_BAS,0.68,,1,Feel excited or happy for no apparent reason.,我無緣無故感到興奮或快樂。,Excitement-seeking,尋求刺激,R33
BIS_BAS,0.68,,1,Get caught up in the excitement when others are celebrating.,當他人慶祝時，我會被興奮感染。,Excitement-seeking,尋求刺激,A71
BIS_BAS,0.68,,1,Get so happy or energetic that I am almost giddy.,我變得如此快樂或精力充沛，幾乎有點頭暈。,Excitement-seeking,尋求刺激,R43
BIS_BAS,,,1,Get stressed out easily.,我容易感到壓力。,Behavioral Inhibition/Activation System,行為抑制/激活系統,X107
BIS_BAS,,,1,Get stressed out easily.,我容易感到壓力。,Anxiety,焦慮,X107
BIS_BAS,0.77,,-1,Hate being the center of attention.,我討厭成為注意力的焦點。,Ambition/Drive,野心/動力,P434
BIS_BAS,0.77,,1,Have a strong need for power.,我有強烈的權力需求。,Ambition/Drive,野心/動力,P445
BIS_BAS,0.79,,1,Have persuaded others to do something really adventurous or crazy.,我說服他人做真正冒險或瘋狂的事。,Risk-taking/Sensation-Seeking/Thrill-Seeking,冒險/尋求感覺/尋求刺激,R58
BIS_BAS,0.77,,1,Know how to get around the rules.,我知道如何規避規則。,Ambition/Drive,野心/動力,H1327
BIS_BAS,0.79,,1,Like to act on a whim.,我喜歡憑一時衝動行事。,Risk-taking/Sensation-Seeking/Thrill-Seeking,冒險/尋求感覺/尋求刺激,E122
BIS_BAS,0.79,,1,Like to behave spontaneously.,我喜歡自發地行為。,Risk-taking/Sensation-Seeking/Thrill-Seeking,冒險/尋求感覺/尋求刺激,D58
BIS_BAS,0.77,,1,Like to show off my body.,我喜歡炫耀我的身體。,Ambition/Drive,野心/動力,P474
BIS_BAS,,,1,Often worry about things that turn out to be unimportant.,我經常擔心事後證明不重要的事情。,Behavioral Inhibition/Activation System,行為抑制/激活系統,D71
BIS_BAS,,,1,Often worry about things that turn out to be unimportant.,我經常擔心事後證明不重要的事情。,Anxiety,焦慮,D71
BIS_BAS,0.79,,1,Prefer friends who are excitingly unpredictable.,我喜歡令人興奮且不可預測的朋友。,Risk-taking/Sensation-Seeking/Thrill-Seeking,冒險/尋求感覺/尋求刺激,R5
BIS_BAS,0.77,,1,Push myself very hard to succeed.,我非常努力地推動自己成功。,Ambition/Drive,野心/動力,Q204
BIS_BAS,0.79,,-1,Rarely enjoy behaving in a silly manner.,我很少享受以愚蠢的方式行為。,Risk-taking/Sensation-Seeking/Thrill-Seeking,冒險/尋求感覺/尋求刺激,D75
