instrument,alpha,alpha2,key,text_en,text_zh,label,label_zh,IPIP_item_number
NEO,0.77,,-1,Never splurge.,我從不揮霍。,Immoderation,放縱,E30
NEO,0.75,,-1,Obstruct others' plans.,我會阻撓他人的計劃。,Morality,道德性,H494
NEO,0.77,,1,Often eat too much.,我經常吃太多。,Immoderation,放縱,X145
NEO,0.88,,1,Often feel blue.,我經常感到憂鬱。,Depression,憂鬱,X74
NEO,0.8,,1,Only feel comfortable with friends.,我只在朋友身邊感到自在。,Self-consciousness,自我意識,H656
NEO,0.82,,1,Panic easily.,我容易驚慌。,Vulnerability,脆弱性,"H948, X64"
NEO,0.71,,1,Pay my bills on time.,我準時繳帳單。,Dutifulness,盡責性,X127
NEO,0.85,,-1,Postpone decisions.,我推遲決定。,Self-discipline,自律,H1180
NEO,0.79,,-1,Prefer to be alone.,我更喜歡獨處。,Gregariousness,合群性,H587
NEO,0.77,,-1,Prefer to stick with things that I know.,我更喜歡堅持我知道的事物。,Adventurousness,冒險性,X30
NEO,0.77,,1,Prefer variety to routine.,我喜歡變化而非常規。,Adventurousness,冒險性,X204
NEO,0.75,,-1,Pretend to be concerned for others.,我假裝關心他人。,Morality,道德性,X113
NEO,0.78,,-1,Put little time and effort into my work.,我在工作上投入很少時間和精力。,Achievement-striving,成就追求,X167
NEO,0.75,,-1,Put people under pressure.,我給人施加壓力。,Morality,道德性,H774
NEO,0.81,,1,Radiate joy.,我散發喜悅。,Cheerfulness,快樂,"H32, X63"
NEO,0.88,,-1,Rarely complain.,我很少抱怨。,Anger,憤怒,E120
NEO,0.81,,-1,Rarely notice my emotional reactions.,我很少注意到自己的情緒反應。,Emotionality,情緒性,X10
NEO,0.77,,-1,Rarely overindulge.,我很少過度放縱。,Immoderation,放縱,X181
NEO,0.71,,1,React quickly.,我反應快速。,Activity-Level,活動水平,H1324
NEO,0.71,,-1,React slowly.,我反應緩慢。,Activity-Level,活動水平,H631
NEO,0.82,,-1,Readily overcome setbacks.,我輕易克服挫折。,Vulnerability,脆弱性,H44
NEO,0.82,,-1,Remain calm under pressure.,我在壓力下保持冷靜。,Vulnerability,脆弱性,X79
NEO,0.76,,-1,Rush into things.,我倉促行事。,Cautiousness,謹慎,"H862, X101"
NEO,0.78,,1,Seek adventure.,我尋求冒險。,Excitement-seeking,尋求刺激,H446
NEO,0.78,,1,Seek danger.,我尋求危險。,Excitement-seeking,尋求刺激,H894
NEO,0.79,,-1,Seek quiet.,我尋求安靜。,Gregariousness,合群性,H602
NEO,0.84,,1,Seek to influence others.,我尋求影響他人。,Assertiveness,自信堅定,H773
NEO,0.88,,-1,Seldom feel blue.,我很少感到憂鬱。,Depression,憂鬱,X156
NEO,0.81,,-1,Seldom get emotional.,我很少情緒化。,Emotionality,情緒性,X29
NEO,0.88,,-1,Seldom get mad.,我很少生氣。,Anger,憤怒,X231
NEO,0.81,,-1,Seldom joke around.,我很少開玩笑。,Cheerfulness,快樂,X137
NEO,0.77,,1,Seldom toot my own horn.,我很少自吹自擂。,Modesty/Humility,謙虛/謙遜,X247
NEO,0.78,,1,Set high standards for myself and others.,我為自己和他人設定高標準。,Achievement-striving,成就追求,E140
NEO,0.83,,1,Spend time reflecting on things.,我花時間反思事物。,Imagination,想像力,X114
NEO,0.85,,1,Start tasks right away.,我馬上開始工作。,Self-discipline,自律,H511
NEO,0.76,,1,Stick to my chosen path.,我堅持我選擇的道路。,Cautiousness,謹慎,H367
NEO,0.75,,1,Stick to the rules.,我遵守規則。,Morality,道德性,H294
NEO,0.8,,1,Stumble over my words.,我說話結結巴巴。,Self-consciousness,自我意識,H1205
NEO,0.75,,1,Suffer from others' sorrows.,我為他人的悲傷而受苦。,Sympathy,同理心,"H988, X65"
NEO,0.75,,1,Sympathize with the homeless.,我同情無家可歸者。,Sympathy,同理心,X259
NEO,0.75,,-1,Take advantage of others.,我占他人便宜。,Morality,道德性,"H427, V109"
NEO,0.77,,-1,Take no time for others.,我不會為他人騰出時間。,Altruism,利他主義,"H918, X170"
NEO,0.71,,1,Tell the truth.,我說實話。,Dutifulness,盡責性,H145
NEO,0.77,,-1,Think highly of myself.,我對自己評價很高。,Modesty/Humility,謙虛/謙遜,H2043
NEO,0.82,,1,Think that all will be well.,我認為一切都會好起來。,Trust,信任,H43
NEO,0.81,,1,Try to understand myself.,我試圖了解自己。,Emotionality,情緒性,E123
NEO,0.77,,-1,Turn my back on others.,我背棄他人。,Altruism,利他主義,H1430
NEO,0.78,,1,Turn plans into actions.,我將計劃轉化為行動。,Achievement-striving,成就追求,H402
NEO,0.75,,-1,Use flattery to get ahead.,我用奉承來求進步。,Morality,道德性,X91
NEO,0.75,,-1,Use others for my own ends.,我利用他人謀取私利。,Morality,道德性,"H416, X24"
NEO,0.75,,1,Value cooperation over competition.,我重視合作勝過競爭。,Sympathy,同理心,X240
NEO,0.82,,1,Want everything to be just right.,我希望一切都恰到好處。,Orderliness,條理性,
NEO,0.79,,-1,Want to be left alone.,我想要被獨處。,Gregariousness,合群性,H660
NEO,0.78,,1,Willing to try anything once.,我願意嘗試任何事。,Excitement-seeking,尋求刺激,
NEO,0.78,,-1,Would never go hang gliding or bungee jumping.,我永遠不會去滑翔傘或高空彈跳。,Excitement-seeking,尋求刺激,
NEO,0.73,,-1,Yell at people.,我會對人大吼。,Cooperation,合作,H809
NEO5-20,0.85,,1,Am easy to satisfy.,我容易滿足。,Agreeableness,親和性,H882
NEO5-20,0.91,,-1,Am hard to get to know.,我很難被了解。,Extraversion,外向性,"H596, X9"
NEO5-20,0.91,,-1,Am not easily frustrated.,我不容易感到沮喪。,Neuroticism,神經質,X59
NEO5-20,0.89,,-1,Am not interested in abstract ideas.,我對抽象概念不感興趣。,Openness To Experience,開放性,X228
NEO5-20,0.89,,-1,Am not interested in theoretical discussions.,我對理論討論不感興趣。,Openness To Experience,開放性,X239
NEO5-20,0.91,,1,Am often down in the dumps.,我經常情緒低落。,Neuroticism,神經質,H640
NEO5-20,0.85,,-1,Am out for my own personal gain.,我是為了自己的個人利益。,Agreeableness,親和性,H1325
NEO5-20,0.91,,-1,Am very pleased with myself.,我對自己非常滿意。,Neuroticism,神經質,"H737, X36"
NEO5-20,0.91,,-1,Avoid contacts with others.,我避免與他人接觸。,Extraversion,外向性,H648
NEO5-20,0.89,,-1,Avoid philosophical discussions.,我避免哲學討論。,Openness To Experience,開放性,X248
NEO5-20,0.89,,1,Believe in the importance of art.,我相信藝術的重要性。,Openness To Experience,開放性,X123
NEO5-20,0.85,,-1,Believe that I am better than others.,我相信自己比他人優越。,Agreeableness,親和性,"H736, X61"
NEO5-20,0.85,,1,Believe that others have good intentions.,我相信他人有善意。,Agreeableness,親和性,H549
NEO5-20,0.89,,-1,Believe that too much tax money goes to support artists.,我相信太多稅金用於支持藝術家。,Openness To Experience,開放性,X20
NEO5-20,0.89,,1,Can say things beautifully.,我能把話說得很漂亮。,Openness To Experience,開放性,H1247
NEO5-20,0.9,,1,Carry out my plans.,我執行我的計劃。,Conscientiousness,盡責性,H258
NEO5-20,0.89,,1,Carry the conversation to a higher level.,我能將對話提升到更高層次。,Openness To Experience,開放性,H1227
NEO5-20,0.91,,1,Cheer people up.,我讓人們振作起來。,Extraversion,外向性,H1151
NEO5-20,0.9,,1,Complete tasks successfully.,我成功完成任務。,Conscientiousness,盡責性,H1285
NEO5-20,0.85,,-1,Contradict others.,我反駁他人。,Agreeableness,親和性,H808
NEO5-20,0.85,,-1,Cut others to pieces.,我會將他人批評得體無完膚。,Agreeableness,親和性,H422
NEO5-20,0.91,,1,Dislike myself.,我不喜歡自己。,Neuroticism,神經質,X15
NEO5-20,0.9,,-1,Do just enough work to get by.,我只做足夠的工作。,Conscientiousness,盡責性,X115
NEO5-20,0.89,,-1,Do not enjoy going to art museums.,我不喜歡去美術館。,Openness To Experience,開放性,X235
NEO5-20,0.89,,-1,Do not like art.,我不喜歡藝術。,Openness To Experience,開放性,X86
NEO5-20,0.89,,-1,Do not like poetry.,我不喜歡詩歌。,Openness To Experience,開放性,X45
NEO5-20,0.9,,-1,Don't put my mind on the task at hand.,我不把注意力放在手頭的任務上。,Conscientiousness,盡責性,H854
NEO5-20,0.9,,-1,Don't see things through.,我不會把事情做完。,Conscientiousness,盡責性,H885
NEO5-20,0.89,,1,Enjoy hearing new ideas.,我喜歡聽到新想法。,Openness To Experience,開放性,X166
NEO5-20,0.89,,1,Enjoy thinking about things.,我喜歡思考事物。,Openness To Experience,開放性,E145
NEO5-20,0.89,,1,Enjoy wild flights of fantasy.,我喜歡狂野的幻想飛行。,Openness To Experience,開放性,X238
NEO5-20,0.91,,1,Fear for the worst.,我擔心最壞的情況。,Neuroticism,神經質,H999
NEO5-20,0.9,,1,Finish what I start.,我完成我開始的事。,Conscientiousness,盡責性,H254
NEO5-20,0.9,,1,Follow through with my plans.,我貫徹我的計劃。,Conscientiousness,盡責性,X196
NEO5-20,0.89,,1,Get excited by new ideas.,我對新想法感到興奮。,Openness To Experience,開放性,H5
NEO5-20,0.89,,1,Have a rich vocabulary.,我的詞彙量很豐富。,Openness To Experience,開放性,"H1276, X245"
NEO5-20,0.85,,-1,Have a sharp tongue.,我說話尖酸刻薄。,Agreeableness,親和性,H917
NEO5-20,0.89,,1,Have a vivid imagination.,我有生動的想像力。,Openness To Experience,開放性,X14
NEO5-20,0.89,,-1,Have difficulty understanding abstract ideas.,我難以理解抽象概念。,Openness To Experience,開放性,X176
NEO5-20,0.91,,-1,Keep others at a distance.,我與他人保持距離。,Extraversion,外向性,H704
NEO5-20,0.9,,-1,Leave things unfinished.,我把事情留下未完成。,Conscientiousness,盡責性,H928
NEO5-20,0.85,,-1,Make demands on others.,我對他人提出要求。,Agreeableness,親和性,H2030
NEO5-20,0.9,,-1,Mess things up.,我把事情搞砸。,Conscientiousness,盡責性,H896
NEO5-20,0.9,,-1,Need a push to get started.,我需要推動才能開始。,Conscientiousness,盡責性,H969
NEO5-20,0.91,,1,Often feel blue.,我經常感到憂鬱。,Neuroticism,神經質,X74
NEO5-20,0.89,,-1,Rarely look for a deeper meaning in things.,我很少尋找事物更深層的意義。,Openness To Experience,開放性,E77
NEO5-20,0.91,,-1,Remain calm under pressure.,我在壓力下保持冷靜。,Neuroticism,神經質,X79
NEO5-20,0.85,,1,Respect others.,我尊重他人。,Agreeableness,親和性,H105
NEO5-20,0.91,,-1,Retreat from others.,我遠離他人。,Extraversion,外向性,H649
NEO5-20,0.91,,-1,Seldom get mad.,我很少生氣。,Neuroticism,神經質,X231
NEO5-20,0.85,,-1,Suspect hidden motives in others.,我懷疑他人有隱藏動機。,Agreeableness,親和性,H604
NEO5-20,0.89,,-1,Tend to vote for conservative political candidates.,我傾向於投票給保守的政治候選人。,Openness To Experience,開放性,X126
NEO5-20,0.89,,1,Tend to vote for liberal political candidates.,我傾向於投票給自由派的政治候選人。,Openness To Experience,開放性,X218
NEO5-20,0.85,,1,Treat all people equally.,我平等對待所有人。,Agreeableness,親和性,"H186, V94"
NEO5-20,0.85,,1,Trust what people say.,我相信人們所說的話。,Agreeableness,親和性,E157
NEO5-20,0.91,,1,Warm up quickly to others.,我很快就能親近他人。,Extraversion,外向性,"H52, X1"
ORAIS,0.69,,1,Acted in a play.,在戲劇中演出。,Creativity/Originality,創造力/原創性,
ORAIS,0.64,,1,Ate candy.,吃糖果。,Interest in Food,對食物的興趣,
ORAIS,0.73,,1,Ate dinner alone.,獨自用餐。,Reclusiveness,隱遁性,
ORAIS,0.64,,1,Ate food while walking or working.,邊走邊工作時吃東西。,Interest in Food,對食物的興趣,
ORAIS,0.64,,1,Ate in a restaurant.,在餐廳用餐。,Interest in Food,對食物的興趣,
ORAIS,0.64,,1,Ate or drank while driving.,開車時吃喝。,Interest in Food,對食物的興趣,
ORAIS,0.64,,1,Ate too much.,吃太多。,Interest in Food,對食物的興趣,
ORAIS,0.82,,1,Attended a ballet performance.,觀看芭蕾舞表演。,Culture,文化素養,
ORAIS,0.89,,1,Attended a church or religious service.,參加教堂或宗教儀式。,Spirituality/Religiousness,靈性/宗教性,
ORAIS,0.57,,1,Attended a formal dance.,參加正式舞會。,Interest in Romance,對浪漫的興趣,
ORAIS,0.82,,1,Attended a public lecture.,參加公開講座。,Culture,文化素養,
ORAIS,0.7,,1,Attended a rally or demonstration.,參加集會或示威活動。,Interest in Political Activism,對政治行動的興趣,
ORAIS,0.82,,1,Attended a stage play or musical.,觀看舞台劇或音樂劇。,Culture,文化素養,
ORAIS,0.7,,1,Attended a town meeting.,參加鎮民大會。,Interest in Political Activism,對政治行動的興趣,
ORAIS,0.79,,1,Attended an athletic event.,參加體育賽事。,Interest in Sports,對運動的興趣,
ORAIS,0.82,,1,Attended an opera or a concert.,參加歌劇或音樂會。,Culture,文化素養,
ORAIS,0.75,,1,"Baked a cake, pie, cookies, or bread.",烤蛋糕、派、餅乾或麵包。,Interest in Home-Making,對家務的興趣,
ORAIS,0.84,,1,Bathed or groomed a pet animal.,為寵物洗澡或梳理毛髮。,Interest in Pets,對寵物的興趣,
ORAIS,0.84,,1,Became intoxicated.,喝醉酒。,Interest in Drinking,對飲酒的興趣,
ORAIS,0.79,,1,Bet money on a sports event.,為體育賽事下注。,Interest in Gambling,對賭博的興趣,
ORAIS,0.84,,1,Bought a book about the things that I collect.,購買關於我收藏的書籍。,Interest in Collecting,對收藏的興趣,
ORAIS,0.75,,1,Bought a book.,購買書籍。,Love of Reading,閱讀熱愛,
ORAIS,0.5,,1,"Bought a car, truck or motorcycle.",購買汽車、卡車或摩托車。,Interest in Vehicles,對車輛的興趣,
ORAIS,0.76,,1,Bought a fashionable item of clothing.,購買時尚的衣服。,Appearance-Consciousness,外表意識,
ORAIS,0.66,,1,Bought a self-help book.,購買自我成長書籍。,Interest in Self-Improvement,對自我改進的興趣,
ORAIS,0.85,,1,Bought or picked flowers.,購買或採摘花朵。,Interest in Gardening,對園藝的興趣,
ORAIS,0.75,,1,Bought or sold real estate.,買賣房地產。,Interest in Money,對金錢的興趣,
ORAIS,0.75,,1,Bought or sold stocks or bonds.,買賣股票或債券。,Interest in Money,對金錢的興趣,
ORAIS,0.85,,1,Bought plants for a garden or yard.,為花園或庭院購買植物。,Interest in Gardening,對園藝的興趣,
ORAIS,0.84,,1,Bought something for my collection.,為我的收藏購買東西。,Interest in Collecting,對收藏的興趣,
ORAIS,0.66,,1,Bought something other than groceries.,購買雜貨以外的東西。,Interest in Shopping,對購物的興趣,
ORAIS,0.84,,1,Cared for a pet animal.,照顧寵物。,Interest in Pets,對寵物的興趣,
ORAIS,0.85,,1,Cared for a potted plant.,照顧盆栽植物。,Interest in Gardening,對園藝的興趣,
ORAIS,0.52,,1,Changed a habit to have less impact on the environment.,改變習慣以減少對環境的影響。,Interest in Environmentalism,對環保的興趣,
ORAIS,0.66,,1,Checked the sales ads in a newspaper.,查看報紙上的促銷廣告。,Interest in Shopping,對購物的興趣,
ORAIS,0.64,,1,Chewed gum.,嚼口香糖。,Interest in Food,對食物的興趣,
ORAIS,0.73,,1,Chose to spend a day by myself.,選擇獨自度過一天。,Reclusiveness,隱遁性,
ORAIS,0.75,,1,Cleaned the house.,打掃房子。,Interest in Home-Making,對家務的興趣,
ORAIS,0.52,,1,Composted food scraps or yard waste.,堆肥廚餘或庭院廢物。,Interest in Environmentalism,對環保的興趣,
ORAIS,0.75,,1,Cooked a meal.,煮飯。,Interest in Home-Making,對家務的興趣,
ORAIS,0.85,,1,Did aerobic exercise.,做有氧運動。,Interest in Exercise,對運動的興趣,
ORAIS,0.85,,1,Did yard work.,做庭院工作。,Interest in Gardening,對園藝的興趣,
ORAIS,0.85,,1,Did yoga or other movement exercises.,做瑜伽或其他運動。,Interest in Exercise,對運動的興趣,
ORAIS,0.57,,1,Dined by candle light.,燭光晚餐。,Interest in Romance,對浪漫的興趣,
ORAIS,0.89,,1,Discussed religion or spirituality.,討論宗教或靈性。,Spirituality/Religiousness,靈性/宗教性,
ORAIS,0.79,,1,Discussed sports.,討論運動。,Interest in Sports,對運動的興趣,
ORAIS,0.7,,1,Donated money to a political campaign or cause.,為政治競選或事業捐款。,Interest in Political Activism,對政治行動的興趣,
ORAIS,0.7,,1,Donated money to charity.,捐款給慈善機構。,Interest in Political Activism,對政治行動的興趣,
ORAIS,0.77,,1,Downloaded music from the Internet.,從網路下載音樂。,Interest in Music,對音樂的興趣,
ORAIS,0.84,,1,Drank beer or wine.,喝啤酒或葡萄酒。,Interest in Drinking,對飲酒的興趣,
ORAIS,0.84,,1,Drank in a bar or night club.,在酒吧或夜總會喝酒。,Interest in Drinking,對飲酒的興趣,
ORAIS,0.84,,1,"Drank whiskey, vodka, gin, or other hard liquor.",喝威士忌、伏特加、琴酒或其他烈酒。,Interest in Drinking,對飲酒的興趣,
ORAIS,0.66,,1,Enrolled in a course of study.,註冊學習課程。,Interest in Self-Improvement,對自我改進的興趣,
ORAIS,0.82,,1,Entertained six or more people.,招待六人或更多人。,Interest in Pets,對寵物的興趣,
ORAIS,0.85,,1,Exercised for 40 minutes or longer.,運動40分鐘或更長時間。,Interest in Exercise,對運動的興趣,
ORAIS,0.84,,1,Fed a pet animal.,餵養寵物。,Interest in Pets,對寵物的興趣,
ORAIS,0.79,,1,Gambled on a slot machine or video poker game.,在老虎機或電子撲克機上賭博。,Interest in Gambling,對賭博的興趣,
ORAIS,0.79,,1,Gambled with cards or dice.,用紙牌或骰子賭博。,Interest in Gambling,對賭博的興趣,
ORAIS,0.85,,1,Gardened.,做園藝。,Interest in Gardening,對園藝的興趣,
ORAIS,0.89,,1,Gave a blessing at a meal.,在餐前祈禱。,Spirituality/Religiousness,靈性/宗教性,
ORAIS,0.84,,1,Had a hangover.,宿醉。,Interest in Drinking,對飲酒的興趣,
ORAIS,0.82,,1,Had someone over for dinner.,邀請某人來家裡吃晚飯。,Gregariousness,合群性,
ORAIS,0.75,,1,Ironed linens or clothes.,燙亞麻布或衣服。,Interest in Home-Making,對家務的興趣,
ORAIS,0.75,,1,"Knitted, quilted, sewed, or crocheted.",編織、拼布、縫紉或鉤針編織。,Interest in Home-Making,對家務的興趣,
ORAIS,0.65,,1,Learned a new board or card game.,學習新的桌遊或紙牌遊戲。,Interest in Game-Playing,對遊戲的興趣,
ORAIS,0.66,,1,Learned a new skill.,學習新技能。,Interest in Self-Improvement,對自我改進的興趣,
ORAIS,0.86,,1,Let a child win a game.,讓孩子贏得遊戲。,Interest in Children,對兒童的興趣,
ORAIS,0.85,,1,Lifted weights.,舉重。,Interest in Exercise,對運動的興趣,
ORAIS,0.89,,1,Listened to a religious program on the radio or TV.,在收音機或電視上收聽宗教節目。,Spirituality/Religiousness,靈性/宗教性,
ORAIS,0.77,,1,Listened to music on the radio.,在收音機上聽音樂。,Interest in Music,對音樂的興趣,
ORAIS,0.77,,1,Listened to music while working.,工作時聽音樂。,Interest in Music,對音樂的興趣,
ORAIS,0.61,,1,Looked something up in an encyclopedia.,在百科全書中查找資料。,Love of Learning,學習熱愛,
ORAIS,0.61,,1,Looked up a word in a dictionary.,在字典中查字。,Love of Learning,學習熱愛,
ORAIS,0.89,,1,Looked up information on the Internet.,在網路上查找資訊。,Interest in Computing,對電腦的興趣,
ORAIS,0.75,,1,Made a bed.,鋪床。,Interest in Home-Making,對家務的興趣,
ORAIS,0.6,,1,Made an entry in a diary or journal.,在日記或日誌中記錄。,Interest in Journaling,對日誌的興趣,
ORAIS,0.69,,1,Made an entry on a personal web-page.,在個人網頁上發表文章。,Interest in Social Media,對社交媒體的興趣,
ORAIS,0.75,,1,Obtained stock market prices.,獲取股市價格。,Interest in Money,對金錢的興趣,
ORAIS,0.64,,1,Ordered food to be delivered.,訂購外送食物。,Interest in Food,對食物的興趣,
ORAIS,0.69,,1,Painted a picture.,畫畫。,Creativity/Originality,創造力/原創性,
ORAIS,0.85,,1,Participated in an exercise program.,參加運動計畫。,Interest in Exercise,對運動的興趣,
ORAIS,0.69,,1,Participated in an online discussion group.,參加線上討論小組。,Interest in Social Media,對社交媒體的興趣,
ORAIS,0.52,,1,Picked up litter.,撿垃圾。,Interest in Environmentalism,對環保的興趣,
ORAIS,0.82,,1,Planned a party.,計劃派對。,Gregariousness,合群性,
ORAIS,0.85,,1,Planted or transplanted a plant.,種植或移植植物。,Interest in Gardening,對園藝的興趣,
ORAIS,0.65,,1,Played a board game.,玩桌遊。,Interest in Game-Playing,對遊戲的興趣,
ORAIS,0.89,,1,Played a computer game.,玩電腦遊戲。,Interest in Computing,對電腦的興趣,
ORAIS,0.69,,1,Played a musical instrument.,演奏樂器。,Creativity/Originality,創造力/原創性,
ORAIS,0.79,,1,Played a team sport.,參加團隊運動。,Interest in Sports,對運動的興趣,
ORAIS,0.79,,1,Played basketball.,打籃球。,Interest in Sports,對運動的興趣,
ORAIS,0.79,,1,Played bingo for money.,玩賓果遊戲賭錢。,Interest in Gambling,對賭博的興趣,
ORAIS,0.65,,1,Played cards.,打牌。,Interest in Game-Playing,對遊戲的興趣,
ORAIS,0.65,,1,Played chess or checkers.,下棋或西洋跳棋。,Interest in Game-Playing,對遊戲的興趣,
ORAIS,0.79,,1,Played tennis or golf.,打網球或高爾夫球。,Interest in Sports,對運動的興趣,
ORAIS,0.86,,1,Played with a child.,和孩子玩耍。,Interest in Children,對兒童的興趣,
ORAIS,0.84,,1,Played with a pet animal.,和寵物玩耍。,Interest in Pets,對寵物的興趣,
ORAIS,0.89,,1,Prayed (not including blessings at meals).,祈禱（不包括餐前祝福）。,Spirituality/Religiousness,靈性/宗教性,
ORAIS,0.69,,1,Produced a work of art.,創作藝術作品。,Creativity/Originality,創造力/原創性,
ORAIS,0.75,,1,Purchased a commodity as an investment.,購買商品作為投資。,Interest in Money,對金錢的興趣,
ORAIS,0.77,,1,Purchased a musical album.,購買音樂專輯。,Interest in Music,對音樂的興趣,
ORAIS,0.84,,1,Purchased a pet animal.,購買寵物。,Interest in Pets,對寵物的興趣,
ORAIS,0.79,,1,Purchased a scratch ticket.,購買刮刮樂彩票。,Interest in Gambling,對賭博的興趣,
ORAIS,0.6,,1,Put pictures in a photo album.,把照片放進相簿。,Interest in Journaling,對日誌的興趣,
ORAIS,0.5,,1,"Raced a car, truck or motorcycle.",賽車、卡車或摩托車。,Interest in Vehicles,對車輛的興趣,
ORAIS,0.89,,1,Read a book about religion or spirituality.,閱讀關於宗教或靈性的書籍。,Spirituality/Religiousness,靈性/宗教性,
ORAIS,0.84,,1,Read a book about the things that I collect.,閱讀關於我收藏的書籍。,Interest in Collecting,對收藏的興趣,
ORAIS,0.75,,1,Read a book on a financial topic.,閱讀財經主題的書籍。,Interest in Money,對金錢的興趣,
ORAIS,0.75,,1,Read a book.,閱讀書籍。,Love of Reading,閱讀熱愛,
ORAIS,0.5,,1,Read a car magazine or book.,閱讀汽車雜誌或書籍。,Interest in Vehicles,對車輛的興趣,
ORAIS,0.76,,1,Read a fashion-related book.,閱讀時尚相關書籍。,Appearance-Consciousness,外表意識,
ORAIS,0.76,,1,Read a fashion-related magazine.,閱讀時尚相關雜誌。,Appearance-Consciousness,外表意識,
ORAIS,0.61,,1,Read a news magazine.,閱讀新聞雜誌。,Love of Learning,學習熱愛,
ORAIS,0.66,,1,Read a self-help book.,閱讀自我成長書籍。,Interest in Self-Improvement,對自我改進的興趣,
ORAIS,0.86,,1,Read a story to a child.,為孩子讀故事。,Interest in Children,對兒童的興趣,
ORAIS,0.75,,1,Read an entire book in one sitting.,一次看完整本書。,Love of Reading,閱讀熱愛,
ORAIS,0.75,,1,Read in bed before going to sleep.,睡前在床上閱讀。,Love of Reading,閱讀熱愛,
ORAIS,0.77,,1,Read music-related news.,閱讀音樂相關新聞。,Interest in Music,對音樂的興趣,
ORAIS,0.89,,1,Read news on the Internet.,在網路上閱讀新聞。,Interest in Computing,對電腦的興趣,
ORAIS,0.66,,1,Read newspaper ads for non-grocery items.,閱讀報紙上非雜貨商品的廣告。,Interest in Shopping,對購物的興趣,
ORAIS,0.61,,1,Read poetry.,閱讀詩歌。,Love of Learning,學習熱愛,
ORAIS,0.69,,1,Read someone��s personal web-page.,閱讀某人的個人網頁。,Interest in Social Media,對社交媒體的興趣,
ORAIS,0.89,,1,Read the Bible or other sacred text.,閱讀聖經或其他神聖文本。,Spirituality/Religiousness,靈性/宗教性,
ORAIS,0.86,,1,Read the comics to a child.,為孩子朗讀漫畫。,Interest in Children,對兒童的興趣,
ORAIS,0.61,,1,Read the editorial page of a newspaper.,閱讀報紙的社論版。,Love of Learning,學習熱愛,
ORAIS,0.61,,1,Recorded a television program.,錄製電視節目。,Interest in Watching Television,對看電視的興趣,
ORAIS,0.52,,1,Recycled one or more items.,回收一個或多個物品。,Interest in Environmentalism,對環保的興趣,
ORAIS,0.5,,1,Rode a motorcycle.,騎摩托車。,Interest in Vehicles,對車輛的興趣,
ORAIS,0.69,,1,Sang or played an instrument in public.,在公開場合唱歌或演奏樂器。,Creativity/Originality,創造力/原創性,
ORAIS,0.89,,1,Sent a message by electronic mail (e-mail).,發送電子郵件。,Interest in Computing,對電腦的興趣,
ORAIS,0.86,,1,Served as a baby sitter.,擔任保姆。,Interest in Children,對兒童的興趣,
ORAIS,0.77,,1,Shopped in a music store.,在音樂商店購物。,Interest in Music,對音樂的興趣,
ORAIS,0.66,,1,Shopped on the web.,在網路上購物。,Interest in Shopping,對購物的興趣,
ORAIS,0.7,,1,Signed a petition.,簽署請願書。,Interest in Political Activism,對政治行動的興趣,
ORAIS,0.66,,1,Spent 10 minutes or more in a non-grocery store.,在非雜貨商店待10分鐘或更長時間。,Interest in Shopping,對購物的興趣,
